URL,Author Name,Likes,Comments,Post Title,Caption,Date Published,Images,Author Avatar,Stars,Author Collect Nr,Author Fans Nr,Author Note Nr,Video URL,User URL
66aa25260000000027012206,小红薯63DFCF89,1496,共 126 条评论,商科留学，选专业一定要慎重，未来不吃亏！,留学商科专业选择，关键在于了解自己的兴趣所在，并找到与之匹配的大方向。这样，选校过程就能更加gao效❗ . 定量组：如果你擅长数学和编程，这些专业可能适合你。 1.金融科技(Fintech)：结合金融知识和计算机技能，是金融行业的新宠。 2.金融工程(Financial Engineering)：金融、数学、物理或工程学背景的你，将进修高等数学和概率论等课程。 3.金融(Finance)：强调定量分析能力，经济学和会计等课程是基础。 4.精算(Actuarial Science)：数学或统计学背景，加上jie决问题的能力，是精算师的必备。 5.信息系统管理(Management Information Systems)：计算机科学或管理学背景，将助你掌握数据库管理和信息系统设计。 6.商业分析(Business Analytics)：统计学和数据分析能力，是商业分析领域的基石。 . 传统商科：如果你对商业运作和管理有兴趣，以下专业可能适合你。 1.管理(Management)：了解基本管理原理和组织行为，是成为优质管理者的起点。 2.会计(Accounting)：商业或会计背景，加上财务管理和审计原理的学习，是会计专业的核心。 . 软专业组：如果你的强项在于沟通和人际交往，这些专业可能更适合你。 1.市场营销(Marketing)：营销和沟通能力，加上市场研究和消费者行为学的学习，是市场营销专业的关键。 2.供应链管理(Supply Chain Management)：物流和运营管理背景，将帮助你掌握项目管理技能。 3.人力资源(Human Resources)：管理、心理学或社会学背景，加上组织行为学和劳动法的学习，是人力资源管理的基础。 4.国际商务(International Business)：商业、管理学或国际关系背景，加上国际贸易和quan球市场营销的学习，是国际商务专业的核心。 . 选择专业时，记得考虑自己的兴趣和背景，这样你的留学之路才能更加顺畅。别忘了，适合自己的才是zui好的！ #商科 #商科留学 #商科硕士 #留学申请季 #留学干货 #留学 #留学申请指南,07-31,images/66aa25260000000027012206.jpg,avatars/66aa25260000000027012206.jpg,1,0,0,0,N/A,/search_result/66aa25260000000027012206?xsec_token=ABc2hOAUpWxxUOTRDPNHSViag9ouMHngyKceB-ZH23ACM=&xsec_source=
6602dac8000000001203cb47,花街躺学家留学,1148,共 108 条评论,人间清醒:从不存在哈耶普斯麻，只有耶和麻,"HYMPS是商科申请人绕不过去的女神。躺哥一文带你了解HYMPS商科项目，和录取难度。 本文干货之干是我提笔之前也没想到的，请观众慢慢读！ 核心观点：普通人能申请的HYMPS商科硕士项目只有Yale M2M, Yale AM 和MIT MFin. 对于HYMPS商科硕士，入门级的本科背景要求是： US Top 40+3.8GPA+数理+经济本+3段国内实习（头部） 这类候选人上岸HYMPS率应该在 15-20%之间。 如果没有理工科背景则录取更难 (5-10%） 本文结构 ①	HYMPS商科专业一览 ②	这些专业的口味和难度排序（分四档） ③	对普通人，没有 HPS，只有 YM ④	没有神级背景，你的录取概率估算 针对想冲HYMPS的申请人，本文提供大量干货。为你的25Fall申请奠定一个理中客的上岸概率估算。 	 请看图！ 	 #留学 #哲学思考 #观点分享 #看世界 #人生 #个人成长 #商科 #商科留学 #留学科研背景提升 #数据科学 #你无法超越的躺哥 #商科申请 #金融工程 #商业分析 #hymps #HARVARD #Yale #MIT #Stanford #Princeton #深圳湾一号 #如果你录取了以下项目，你会去",03-26,images/6602dac8000000001203cb47.jpg,avatars/6602dac8000000001203cb47.jpg,1,0,0,0,N/A,/search_result/6602dac8000000001203cb47?xsec_token=ABqqB1AURvfc9ksEc3yedQEGPvaI3tsTsKjISO2fUx_0o=&xsec_source=
671f9138000000002401960e,姜姜说留学,51,共 6 条评论,美国1年制STEM商科类硕士汇总,"根据美国劳工统计局的数据，STEM专业带动的工作岗位，其增长速度和薪酬水平均在美国就业市场处于领先地位（STEM硕士项目的毕业生，可延长他们的选择性实习培训（OPT）至36个月）。 	 1年制的STEM硕士项目时间短🥰，留学成.本也相对较低。 	 👇下面，为大家整理了2025美国名校1年制STEM商科/泛商科硕士项目及申请要求，感兴趣的同学可做参考。 	 哥伦比亚大学 约翰霍普金斯大学 圣路易斯华盛顿大学 密歇根大学安娜堡分校 南加州大学 德州大学奥斯汀分校 东北大学 	 💪🏻美国一年制STEM硕士，相比2年制硕士，时长、费用均砍半。可谓将成.本降到蕞低，就业力拉到蕞高，简直是性价比天.花板！太值得留子们冲了! - ✨而且就业面更广、起薪更高、拿绿卡更容易！STEM项目的中国留学生平均薪资可达到560,000至5100,000之间 	 具体申请要求、学费、学制看图文哦 👉需要了解美国一年制商科硕士申请的，留1 	 #美国留学申请 #25fall美国留学 #美国硕士留学 #留学美国 #美国一年制硕士申请条件 #美国一年制硕士留学 #美国一年制商科硕士 #美国一年制硕士 #一年制商科 #商科留学",10-28,images/671f9138000000002401960e.jpg,avatars/671f9138000000002401960e.jpg,1,0,0,0,N/A,/search_result/671f9138000000002401960e?xsec_token=ABN-deT_NSW6qbk2S61WV6ORlsqnPfvAg7nhUjyvIh-1E=&xsec_source=
66bdd6460000000005023b4d,是今今学姐呀,15,0,美研1年制商科硕士💰学制短好就业‼️,🇺🇸美国商科一年制硕士真的是有很多项目！相对于其他国家大多数是两年制度的硕士，美国商科一年制的硕士项目真的是很！友！好！了！👍👍 ⭕为此今今学姐熬夜为各位宝子整理了一批含金量极高的1年制美国商科硕士项目😎 1️⃣会计硕士项目 2️⃣市场营销硕士项目 3️⃣金融硕士项目 4️⃣商业分析硕士项目 — 🙋我是今今学姐 🎊美国留学问题欢迎随时撩我 #留学 #留学中介 #一年制硕士 #硕士留学 #美国一年制商科硕士 #美国一年制硕士 #美国一年制硕士留学 #美国商科 #美国商科硕士 #美国商科留学,08-15,images/66bdd6460000000005023b4d.jpg,avatars/66bdd6460000000005023b4d.jpg,1,0,0,0,N/A,/search_result/66bdd6460000000005023b4d?xsec_token=AB3Um1xd5erMaWD49B2xKqcpKkmae6oDdNGxDkTb_q2Co=&xsec_source=
66b04297000000001e01e7fa,耿直BOY,163,共 166 条评论,全球商科硕士第一的HEC为啥国内很少人知道,Hello 大家好我是Kevin，HEC Paris和Ivey 毕业的商科硕士，有五年的战略咨询经验，三年半在LEK，现在刚跳槽到欧洲的Bain，明年年初入职。正值巴黎奥运会期间，为大家介绍一下我的母校，朱珠就读过的欧洲“清华”巴黎高等商学院 	 首选，作为和哈佛沃顿斯坦福商学院平起平坐的HEC，为什么国内的不管HR或者出国留学的很少知道。第一个原因可能是地处法国的关系，毕竟不像英美澳加一样作为大部分留学生的首选。其次，中介很少给来咨询的学生推HEC。因为有能力申请的都自己DIY了，而且HEC最近才开放学士学位，硕士学位据说申请难度很高，很多清北本科的六边形战士也无缘HEC。因此，中介并不想承担这样一个吃力不讨好的而且申请风险极大的项目。 	 说完了知名度后，来聊一聊HEC的就读体验。首先是学员质量，因为我是Ivey交换过去的，来到这边就读的不是清华就是北大的学生，学员质量完全没的说。其次是校园活动，虽然地处离市中心很远的Jouy-en-Josas小镇，但是HEC完全不缺networking和大佬演讲的场合。不是这周来了个前总理演讲，要不就是哪个大型公司的CEO做讲座，活动多到完全参加不过来！ 	 对于课程规划来说，与大部分顶尖商学院一样，会用到案例教学。而且在课堂上，学员与教授之间的互动还蛮多的，不会出现教授一直在课堂上讲课的尴尬场面。因为周围的学员都是从各国来的顶尖学子，特别喜欢在课堂上展现自己。 	 最后说一下HEC学生毕业后的就业方向，大部分的毕业生从事的还是投行与咨询相关的工作。因为自己本身是做咨询的，所以深知简历上有HEC在欧洲找工作干脆不需要networking的快感。欧洲MBB1/3以上有HEC的校友一点也不夸张。所以今后想在欧洲找咨询工作的小伙伴来说，能申请上HEC的话确实是首选，应该没有之一 	 如果点赞够多的话，下期可以分享一下我加拿大🇨🇦顶尖商学院Ivey的就读体验以及CEMS全球🌍顶尖商学院硕士的申请流程，大家敬请期待～ 	 #巴黎奥运会 #HEC #朱珠,编辑于 08-05,images/66b04297000000001e01e7fa.jpg,avatars/66b04297000000001e01e7fa.jpg,1,0,0,0,N/A,/search_result/66b04297000000001e01e7fa?xsec_token=ABXofHKM6QCJ2sMyoz0V20uQY-4gV5ClTYhxQBFL0qqrY=&xsec_source=
66bf28200000000005031860,Rachel学姐🐙,87,0,美国泛商科水项目盘点6️⃣申请条件盘点,🌟想读商科又想进名校，但背景不够强？来看看美国名校的泛商科水项目吧！低绩点的同学也有机会冲哦！这些学校的综合排名在全世界都名列前茅，毕业后回国的认可度是有目共睹的！未来想回国就业的同学来说是非常好的选择！ 学姐为大家整理了美国的名校泛商科水项目。大家关心的项目的学制、学费、核心课程、被录取的同学的最低背景、就业方向等等都为大家进行了整理。 🔥项目的注水指数从5星到0.5星（申请难度从小到大）本期为大家带来的是2-1星的部分项目，让我们一起来看看吧 #美国大学 #美国大学申请 #美國留學 #美国研究生 #美国研究生申请 #美研 #藤校#留学美国#留学申请指南#留学美国 #美国留学中介#美国硕士 #美国硕士申请 #美国硕士 #美国硕士留学,编辑于 10-10,images/66bf28200000000005031860.jpg,avatars/66bf28200000000005031860.jpg,1,0,0,0,N/A,/search_result/66bf28200000000005031860?xsec_token=ABT_ZUM5vVni_Q4u1i_1SVIhfrTPIpGzB9u02Kyyaq304=&xsec_source=
6740254e000000000201857a,动物奶油🍯,49,共 23 条评论,25fall低成本DIY申请商科硕士指南（避雷版）,我从大一暑假开始规划留学，当时了解了很多机构，申请中介、语言机构，甚至付费实习....留学申请（尤其是美国）就是拼信息差，其实很多步骤都能省钱！ 1⃣雅思/GRE 我托福雅思都考过，因为我从高中开始弱势就是听力，所以我觉得雅思明显比托福简单很多，尤其是听力阅读最最重要的是！雅思电子版送分免费，托福送一所就要146r❗️ 雅思：我推荐机考，阅读、作文很方便，且体感机考比纸笔简单的概率更高。主要刷剑桥雅思（所有网站基本都免费）和考场真题（学为贵添加客服就能🆓做，其他网站几乎都要钱，但答案有的时候会匹配错，自己对一下就行）口语作文可以让AI帮忙修改。除非特别不自律或基础很差，不然没必要报班学雅思❗️ GRE：之前笔记有详细讲～ 2⃣实习 商科除了标化，最重要的就是实习，毕竟本来就是实践学科，而且🇺🇸非常看重“多元性”可以是实习，创业等任何能体现你匹配这个专业+与众不同的点。 26/27fall要尽快开始找实习啦，所有付费实习，付费内推，不要参加❌且不说背调会有问题，一两个月的实习cost 2-3w，花钱给别人当牛马，而且这种还学不到东西。 自己精心准备简历（根据JD改，强调自己在项目或者之前实习的产出）都有机会～bg不好从小公司开始积累经验再去大厂 3⃣选校 花大几万找中介，不如自己利用🆓网络资源，🔍【留学择校指南】详见p3-5，有之前往年录取案例供参考大数据选校给的冲刺/稳妥/适中3档选校方案，自己diy都可以了，院校库内还有往年的录取信息和申请资料 4⃣文书/英文简历 常见的留学中介有：耳熟能详的大机构、以“文书”著名的工作室，我和我身边同学都签了这些机构，交着大几万的中介费，拿着又水又没用的简历（尤其是实习部分，别的其实格式正确就问题不大，我和我同学都有3段以上实习经历，也有big name实习） 写得烂的原因主要有2种： 1、中介没好好挖掘 2、常年做中介，没有真正该岗位/专业的海外工作经验不知道好的简历长什么样 找申请过这个专业+在海外的对口岗位工作的人（他们通常以写文书 改简历为副业）他们价格通常在1w以内，远低于市面上留学中介！ 祝大家都能offer多多～ #25fall #美国留学生 #留学申请季 #留学申请指南 #低成本留学 #美国留学申请 #商科留学 #美国硕士申请,11-22 上海,images/6740254e000000000201857a.jpg,avatars/6740254e000000000201857a.jpg,1,0,0,0,N/A,/search_result/6740254e000000000201857a?xsec_token=ABtaVgsMONH0TVfbHMGSdE72C2YCSrfl4fSCmurFbX_Fc=&xsec_source=
66f7ddb2000000002c02c8ee,viki学姐硕博留学,47,共 7 条评论,🇺🇸美国会计（Accounting）硕士项目汇,🧮会计学是美国留学的热门选择，作为美国商学院的传统专业方向之一，一直保持着较为稳定的就业需求。会计学也一直是留学的热门选择🔥。 ～ 🔔今天，学姐对美国会计（Accounting）硕士院校项目进行了汇总，并附上申请要求⬇️ 🏫哥伦比亚大学 🏫纽约大学 🏫德克萨斯大学—奥斯汀分校 🏫范德比尔特大学 🏫密歇根大学—安娜堡 🏫康奈尔大学 🏫圣母大学 🏫华盛顿大学 🏫圣路易斯华盛顿大学 🏫弗吉尼亚大学 🏫弗吉尼亚大学 🏫加州大学-欧文分校 🏫加州大学圣地亚哥分校 ～ ✅申请要求： 👉GPA：需至少3.3，最好3.5+。 👉托福：普遍要求100+，Top30则需105+。 👉GMAT：首选，部分学校接受GRE。Top50项目均分约690-710，建议目标700+。 👉先修课程提示： 会计学专业性高，MSA项目虽对非会计背景学生开放，但要求具备相关基础知识。 ～ 👉工作经验建议： 国内应届毕业生申请时，建议积累会计实习经验，尤其是四大会计师事务所（普华永道、德勤、毕马威、安永）的实习，或证券公司、投资公司、外资银行等会计相关领域经验，以提升申请优势。#商科留学 #商科 #留学选校 #研究生申请 #美国会计 #美国会计硕士申请 #美国会计硕士 #美国会计硕士,09-28,images/66f7ddb2000000002c02c8ee.jpg,avatars/66f7ddb2000000002c02c8ee.jpg,1,0,0,0,N/A,/search_result/66f7ddb2000000002c02c8ee?xsec_token=ABtMnnPjXa7bbQpjaexoKS1NJuYhdQV_UIQk99kbHWLPI=&xsec_source=
669e2fc5000000000a0072c4,IsIa学姐留学日记,141,0,太全了‼️美国商科20个细分专业详情✅️,商科主要划分 ✅️数学好：商业分析、金融工程、统计、数据科学 ✅️数学一般：金融、会计、经济学 ✅️数学差：人力资源、公共管理、管理学、市场营销、旅游酒店管理、商务管理专业 	 商科其中热门很多专业涉及了数理、计算机等专业，应用性强，难度越大，竞争力所以也高，偏文科类的专业相比之前就竞争压力小一些，但是不管热门与否还是那句话看个人兴趣及能力，不能因为热门硬着头皮去选，得不偿失！！ 	 #留学 #留学美国 #美国商科硕士 #美国商科研究生申请 #美国研究生申请 #美国硕士申请 #美国研究生申请规划 #美国硕士申请规划 #美国选校定位 #商科 #金工金数 #商业分析 #留学经验分享 #留学干货分享,07-22,images/669e2fc5000000000a0072c4.jpg,avatars/669e2fc5000000000a0072c4.jpg,1,0,0,0,N/A,/search_result/669e2fc5000000000a0072c4?xsec_token=ABtYaO-HCLIJHg1q79i_Y8sL9jXraLcjdZFtjtSzMK-dc=&xsec_source=
6603f2b10000000012033c24,Cheese学姐留学指南,214,共 36 条评论,美国TOP30金融硕士🎓高薪专业真不要错过,"留学的热门专业里，金融类几乎可以算是第一，不少本科学其他类型专业的学生，也会通过在研究生阶段读金融来转行 · 无论是市场需求还是薪资水平，都确实有很大的吸引力 · 作为留学目的地大热门的美国，自然也有很多院校的金融硕士专业可供选择 今天Cheese学姐就为了响应大家的需求，给大家整理一篇美国TOP30的金融专业 · ☑️Princeton University普林斯顿大学： ♦️Master of Finance金融学硕士 ♦️Columbia University哥伦比亚大学： ♦️Enterprise Risk Management企业风险管理硕士； ♦️Master of Science in Financial Economics金融经济学硕士 ☑️Massachusetts Institute of Technology (MIT)麻省理工学院： ♦️Master of Finance金融学硕士 ☑️Yale University耶鲁大学： ♦️Master’s Degree in Asset Management资产管理硕士 ☑️Johns Hopkins University约翰霍普金斯大学： ♦️Finance, Master of Science金融学硕士； ♦️International Economics and Finance, Master of Arts国际经济与金融硕士 ☑️Washington University in St Louis圣路易斯华盛顿大学： ♦️MS in Finance-Wealth and Asset Management Program金融学硕士-财富与资产管理； ♦️MS in Finance-Quantitative Finance Program金融学硕士-量化金融； ♦️MS in Finance-Corporate Finance and Investments ♦️Program金融学硕士-企业金融与投资； ♦️MS in Finance-Global Finance金融学硕士-全球金融 ☑️Vanderbilt University范德堡大学： ♦️MS Finance金融学硕士 ♦️University of Notre Dame圣母大学： ♦️Master of Science in Finance金融学硕士 ....... ⭐⭐由于篇幅有限，需要详细了解的宝子可以直接看图文， 金融学硕士商科背景或者数理背景的本科生都可以申请，转专业申请也是可行的 但是如果你具有较高的数学和计算机能力会比较有优势 如果你需要跨专业，但是背景、绩点不够，可以选择找机构呢，刚好学姐之前收到的同学投稿中就有跨专业的的，并且成功拿到了offer，这不也给大家整理出来了 · 🌈推，第一家美国留学机构：A 🌈推，第二家美国留学机构：B #留学美国 #美國留學 #美国大学申请 #金融 #MBA #美国大学 #美国留学申请 #美国研究生 #美国研究生申请 #美研 #美本#留学那些事#美國留學 #留学美国",编辑于 03-27,images/6603f2b10000000012033c24.jpg,avatars/6603f2b10000000012033c24.jpg,1,0,0,0,N/A,/search_result/6603f2b10000000012033c24?xsec_token=ABALokOeF0WTlv6XVBV-_ooAvYSHn6Whh_seErJjq1-X0=&xsec_source=
6543c351000000000403b154,君不见永夜,321,共 102 条评论,读商业分析硕士真的是裂开,本人读MSBA的感受 	 每天的上课流程：我是谁？我在哪儿？这老师在讲什么？有什么用吗？我为什么要学这玩意儿？现在BA还sponsor吗，怎么一家公司都没有？为啥来这鬼项目？ 	 #商分 #商业分析 #MSBA #实习 #美本 #美研 #找工 #求职 #研究生 #留学那些事 #留学美国 #留学美国,编辑于 2023-11-02,images/6543c351000000000403b154.jpg,avatars/6543c351000000000403b154.jpg,1,0,0,0,N/A,/search_result/6543c351000000000403b154?xsec_token=ABFFG17peZdKS8EbM8GeTLApTaI5JTp_nDLt8pRZZQIm4=&xsec_source=
65eebf3b000000000d00e10a,专注商科的Kevin,753,0,美国商学院档次表,首先，科普一下，美国顶级商学院已经固定下来了，不需要每年看排名，美国顶尖七所商学院，即M7 - Magic 7的缩写，也是全球商学院申请者梦想去到的顶级院校，分别是： 1. Harvard Business School 哈佛商学院 2.The Wharton School 宾夕法尼亚大学沃顿商学院 3.Stanford Graduate School of Business 斯坦福商学院 4.Northwestern University（Kellogg）西北大学凯洛格商学院 5.MIT Sloan 麻省理工斯隆商学院 6. University of Chicago（Booth）芝加哥大学布斯商学院 7. Columbia Business School 哥伦比亚大学商学院 	 如果说非要排个座次，那么不应该去看排名，只需要分档看即可，同档次的学校实力都是差不多的。 	 申请的时候，同档次之间不用太看排名，还是得选最喜欢的城市/专业领域/校友网络等综合考虑。 	 欢迎咨询商学院申请~ 	 #美国商科硕士 #美国商学院 #美国商学院研究生申请 #美国mba #MBA申请 #美国商科留学,编辑于 05-03,images/65eebf3b000000000d00e10a.jpg,avatars/65eebf3b000000000d00e10a.jpg,1,0,0,0,N/A,/search_result/65eebf3b000000000d00e10a?xsec_token=AB6pfpA94nnxi7VbqiYv9_FMOROH6xz975oMShigD3koE=&xsec_source=
66f8972f000000002a035022,莓莓草莓球🍓,15,共 3 条评论,25全日制MBA & 商科硕士QS排名新出炉🎉,商科专业留学怎么选择留学国家❓ 商科专业留学选什么方向❓ 商科专业留学怎么选院校❓ 	 商科专业作为留学热门专业之一，不少同学都会来问商科专业留学选校的问题🤔 	 商科不但门槛低❗，还可以跨专业申请🥳，无论你是理科、工科还是文科，一般都不会特别卡背景，对于跨申的同学相当友好😍 	 本次汇总了商科专业各学科OS排名top10院校，又是英国美国欧洲位居前列，其次是其他国家，👉总体来看欧洲商科体量更重，所以商科专业想去国外留学的同学可以把重点放在这几个国家🌻，学校多，进入名校的概率才会大，具体排名大家看图哦~ 	 🌈金融/会计推/荐去院校 曼彻斯特大学2025QS全球排名34 MSc Accounting and Finance MSc Finance MSc Financial Economics 	 华威大学2025QS全球排名69 MSc Accounting and Finance MSc Finance MSc Business and Finance …… 🌈市场营销推/荐去院校 爱丁堡大学2025QS全球排名27 MSc Marketing 	 曼彻斯特大学2025QS全球排名34 MSc Marketing 	 谢菲尔德大学2025QS全球排名105 MSc International Management and Marketing MSc Marketing Management Practic 	 🌈商业分析推/荐去院校 爱丁堡大学2025QS全球排名27 MSc Business Analytics 	 曼彻斯特大学2025QS全球排名34 MSc Business Analysis and Strategic Management MSc Business Analytics: Operational Research and Risk Analysis 	 好啦，关于商科OS排名和申请大家还有什么疑问呢❓ #留学 #商科留学 #商科留学生 #商科留学申请 #美国商科留学 #qs世界大学排名 #商科排名 #2025qs商科硕士排名#香港商科留学 #欧洲商科,09-28,images/66f8972f000000002a035022.jpg,avatars/66f8972f000000002a035022.jpg,1,0,0,0,N/A,/search_result/66f8972f000000002a035022?xsec_token=ABGRgIB-7-n-K8rJKyNl3eDwZJbDR4lFAL-ZStEiGlJfs=&xsec_source=
