URL,Author Name,Likes,Comments,Post Title,Caption,Date Published,Images,Author Avatar,Stars,Author Collect Nr,Author Fans Nr,Author Note Nr,Video URL,User URL
663a37ec000000001e027e65,商科留子的懂王,121,共 3 条评论,美国经济学项目学校申请梯度！快来🐎住！,"总结了一下经济学项目的申请梯度！大家做一个参考即可，毕竟具体申请都是要case by case的 👇 🎈【彩票梯度：MIT、耶鲁】 . 是经济学硕士项目中最顶级的存在，顶级学霸的申请领域，除了超高的标化，录取的都是学术水平、科研顶尖水平的学生。 . --- 🎈【第一梯度：芝大、哥大、杜克、UCLA】 主要录取的还是top国本和海本的学生，GPA肯定要3.8以上,并且需要含金量极高的实习科研学术经历! . 这里面的项目主要分为两类，一个是就业导向，包括芝大的MACSS,杜克的MSEC和UCLA的MQE，都是结合计算机和经济政策分析的复合专业，不管对于留美或者回国就业来说都是绝佳的项目。 . 还有就是科研导向的项目，包括芝大MASS，哥大MAE,杜克MAE/MAAPE，对于后面读phd都是非常友好的。 . --- 🎈【第二梯度：哥大、JHU、康奈尔、Umich、NYU】 . 这一梯度可以说是中国留学生申请的主力，学校排名高，回国就业非常有优势，这一梯度录取以海本生、国本985 211学生为主，双非如果各方面背景都很优秀，也是有机会的，GPA最好要在3.6 以上，GRE最好325+。 . --- 🎈【第三梯度：JHU、WUSTL、UW–Madison、UT-Austin、UIUC、Georgetown、USC、BU】 . 像是JHU、Wustl、USC、BU都是美国高排学校回国认可度很高，认可度完全不逊于上一档次的学校，如果回国就业的话是这一档次学校的首选， 然后像是UIUC，UTA和UWM都是属于世界排名很高的全美大公立，读博也很友好，尤其UWM读博友好项目；Georgetown虽然属于世界排名一般，但属于全美排名较高的学校，比较适合标化成绩差一点，或者国本双非的学生申请。 --- 再说一遍！这种梯度只是一个大致分类，也并没有说梯度靠后的就多好申！因为申请都是case by case，这些排名梯度针对到具体的申请都是不一样的！想了解自己适合的项目还是要结合具体bg！ 。 这个号私信关啦，有事可以直接👉@懂王的备用机 #商科留学 #留学选校 #留学美国 #经济学 #econ #美国经济学选校 #美国留学申请",编辑于 05-16,images/663a37ec000000001e027e65.jpg,avatars/663a37ec000000001e027e65.jpg,1,0,0,0,N/A,/search_result/663a37ec000000001e027e65?xsec_token=ABcmvMf4yGtJ0lkreNz3Jf3BwdNzF-qJn2E8AGHcQzg2Q=&xsec_source=
6678cbce000000001d0195c6,Larry学长,12,0,美国金融硕士申请要求大揭秘💢,不论是商科还是理科出身的本科生，皆可涉足金融学硕士，跨专业申请亦非难事。尤其对于数学及计算机技能突出的申请者，更添竞争优势。 美国金融硕士项目，传统强项，植根于商学院体系，以就业为首要目标，学制通常为1至1.5年，且大多标注为STEM，意味享有长达3年的OPT特权。毕业生步入职场，薪酬丰厚，广泛活跃于银行、风投、证券、私募及企业财务等部门。 学长精心整理了一些美硕Top金融项目，鉴于篇幅有限，项目详情请见配图👆 #研究生申请  #美国硕士  #留学热点  #美国求学记  #留学杂谈  #美国留学生活  #留学生必备,06-23,images/6678cbce000000001d0195c6.jpg,avatars/6678cbce000000001d0195c6.jpg,1,0,0,0,N/A,/search_result/6678cbce000000001d0195c6?xsec_token=ABN1-HhwBlFvAZZtPbgiP7awGjMKoqCw1zDl8idgxJ7Xc=&xsec_source=
66b5c9b10000000025033bff,RR是剑桥学姐,15,0,假如商科有段位，谁才是最强王者❓,商科作为热门留学✈专业，很多学商科专业的宝子都有一个留学的梦，那面对那么多国家了院校，很难不眼花缭乱‼ 所以今天就给大家罗列出来一些比较热门🔥的商科留学国家供大家参考‼以及这些热门商科留学国家比较推jian的院校有哪些⁉ . 📍一梯队 美国🇺🇸 麻省理工大学斯隆商学院 克伦比亚大学 杜克大学 西北大学 纽约大学斯特恩商学院 约翰霍普金斯大学 斯坦福大学 哈佛大学 宾夕法尼亚大学沃顿商学院 📍二梯队 英国🇬🇧 伦敦商学院 帝国理工学院商学院 爱丁堡大学商学院 曼彻斯特大学商学院 杜伦大学商学院 利兹大学商学院 伯明翰大学商学院 新加坡🇸🇬 新加坡国立大学 南洋理工大学 📍三梯队 加拿大🇨🇦 多伦多大学 麦吉尔大学 滑铁卢大学 不列颠哥伦比亚大学 蒙特利尔大学 麦克马斯特大学 法国🇫🇷 巴黎高等商学院 法国高等经济商业学院 欧洲商学院 里昂商学院 荷兰🇳🇱 阿姆斯特丹大学 📍四梯队 澳大利亚🇦🇺 墨尔本大学 新南威尔士大学 悉尼大学 德国🇩🇪 慕尼黑大学 科隆大学 瑞典🇸🇪 斯德哥尔摩经济学院 西班牙🇪🇸 马德里自治大学 . 具体的商科留学国家选校定位以及申请要求等，宝子们可以在下面👇👇留下想问的问题，学姐都会一一解答滴‼ #商科 #商科留学 #留学英国 #留学美国 #美国商科留学 #英国商科硕士 #商科硕士 #商科专业留学 #英硕 #美国研究生申请,08-10,images/66b5c9b10000000025033bff.jpg,avatars/66b5c9b10000000025033bff.jpg,1,0,0,0,N/A,/search_result/66b5c9b10000000025033bff?xsec_token=ABodlQ0RUlWsIjJoyMrsmxaNKG9vqsowE5KCmVzhQdu2I=&xsec_source=
670f85ac00000000260346d1,Sara学姐,16,共 2 条评论,美国Top30大学金融硕士项目推荐,美国金融硕士一般都有先修课要求👉比如宏微观经济、微积分、线性代数、金融等。 🔔关于实习经历并非强制要求(NYU除外)，但对于应届毕业生来说，高质量的实习是必要的，是申请加分项❗️ 	 ✅申请建议(根据申请难度) ①第一档 普林斯顿、MUT、耶鲁、哥大MSFE GPA3.85+，托福110+，GRE330+ / GMAT730+ ②第二档 南加大、埃默里、哥大ERM、JHU等 GPA3.6+，托福105+，GRE327+ ③第三档 UVA、WUSTL、UCSD等 GPA3.4+，托福102+，GRE325+ 	 🇺🇸Sara不定期更新美国留学内容 ❤️留学问题欢迎滴滴~ #留学美国 #美国金融硕士 #留学申请指南 #美国研究生申请 #美国大学案例分享 #美国硕士申请,10-16,images/670f85ac00000000260346d1.jpg,avatars/670f85ac00000000260346d1.jpg,1,0,0,0,N/A,/search_result/670f85ac00000000260346d1?xsec_token=ABDoG2YLxoNvLTSIlKBeSC_AjDh8aKe5Ybg5iDsjeR6IE=&xsec_source=
65fa99b60000000013024cc7,Elora老师硕士留学,235,0,藏在留学商科专业中的鄙视链⛓️有被冒犯到,在留学圈，有着各种各样的“鄙视链”，包括地区🌏、学校🏫、专业📒等，一不小心就会“被野鸡”，一不小心就会“被水硕”。 ㅤ 今天我们就看看留学圈谁也看不起谁系列❗ ㅤ 🔍商科在所有学科专业中牢牢占据鄙视链顶端🥰，而且从人数上来说，商科留学生在所有留学生中，队伍也最为庞大:商科&gt;法学&gt;工科&gt;理科&gt;社科&gt;文科&gt;艺术 ㅤ 🔍商科虽然也是留学生best爱🥳的项目之一，但是在商科内部，还有自己的鄙视链，投行的看不起咨询，咨询看不起四大，四大看不起marketing这些... ㅤ 🔍而且，作为留学生两大热门学科，理工科和商科之间也是互相看不上🤨...一个觉得对方赚不如自己多，搞得都是虚头巴脑的东西，不像自己专业的技术；一个觉得对方形象欠佳，不如自己会social。 ㅤ ✅✅✅✅✅✅ㅤ 【现QS 72西澳大学与华东政法大学联合推出 商科1+1硕士留学项目】 ㅤ 西澳大学-澳洲八大之一。 西澳大学商学院排名全球100， 同时获得AACSB和EQUIS两大国际Top商学院认证。 ㅤ ✨无需考研/无需雅思成绩/商科热门专业 ✨（学费+申请费）两年33w ✨留服认证/上海落户 ㅤ 倘若你也有着商科硕士留学梦，想学习最热门专业商科、毕业轻松就业，滴滴老师，离圆梦更进一步 	 #商科硕士 #商科留学 #西澳大学 #华东政法大学 #鄙视链 #留学圈 #商科专业,03-20,images/65fa99b60000000013024cc7.jpg,avatars/65fa99b60000000013024cc7.jpg,1,0,0,0,N/A,/search_result/65fa99b60000000013024cc7?xsec_token=ABS2T7mlF2QLEn-3Z8TE3EXRUMFoTIdJxn13rb0Mt2LrU=&xsec_source=
672211f6000000001a036809,Mick学姐的小圈,8,0,美国商业分析硕士哪家强？名单请参考,今天盘点一下美国前50大学里开设商业分析硕士的学校，大家可以作为选校参考，图中的项目列表以学校综合排名为序。 难度：★★★★★ MIT、哥大、UCLA、CMU、UT-奥斯汀 这几所院校的商业分析项目，基本就是竞争最大的了，尤其是MIT基本就是商分天花板。建议美本或985/211的学生去申请，GPA3.8以上，GRE330，托福108+，配合三段以上高质量实习。 难度：★★★★ 哥大AA、杜克、南加大、Umich、JHU 这几个学校基本上就是背景普通的留学生申请上限了，成绩要求的话最好是GPA3.7+，托福105+，GRE325+，有三段实习会很稳。 难度：★★★ 埃默里、波士顿、UCSD、WUSTL 这些学校是中国留学生申请主流院校，大部分申BA的学生都进入这些项目了，陆本学生建议成绩GPA3.4+，托福100+，GRE325+ 难度：★★ UIUC、维克森林、UCI 对于冲刺前30的学校不够稳妥的学生，这几所可以作为保底之选。 	 🇺🇸米可不定期更新留学干货 ❤️留学问题欢迎滴滴~ #留学美国 #留学申请指南 #硕士留学 #美国硕士申请 #美国大学 #商业分析硕士,10-30,images/672211f6000000001a036809.jpg,avatars/672211f6000000001a036809.jpg,1,0,0,0,N/A,/search_result/672211f6000000001a036809?xsec_token=ABzVzZR9aQ-qWMXumEH2uST3-JOVIHElJJeZ61opm8D6Q=&xsec_source=
66a2f76e000000000600e31b,英留子菲学长,41,共 2 条评论,英国G5大学泛商科水项目合集❗❗,"想去英国G5读商科但又卷不过各路学霸😓 可以看看英国G5的泛商科水项目!🤓不要求必须有G成绩的泛商科项目可以冲!😏作为G5超级精英大学，对于未来想回国就业的同学来说是非常好的选择。😎 为大家整理了G5名校的泛商科一些水项目，包括大家关心的项目的学制、核心课程、申请要求等。 ❤️帝国理工学院 ✔️Master of Public Health公共卫生硕士 ✔️MSc Risk Management &amp; Financial Engineering 风险管理与金融工程硕士 🧡伦敦大学学院 ✔️Global Management of Natural Resources MSc全球自然资源管理理学硕士 ✔️Risk, Disaster and Resilience MSc风险、灾害和复原能力理学硕士 ✔️Health in Urban DevelopmentMSc城市发展中的健康理学硕士 ✔️Digital Innovation Built Asset Management MSc数字创新构建资产管理理学硕士 ✔️Project and Enterprise Management MSc项目与企业管理理学硕士 ✔️Construction Economics and Management MSc建筑经济学与管理理学硕士 💜伦敦政治经济学院 ✔️MSc Financial History金融史理学硕士 ✔️MSc Economic History经济史理学硕士 ✔️MSc Quantitative Methods for Risk Management 风险管理定量方法理学硕士 	 有任何问题欢迎随时④戳关🐷~ 	 #留學 #英国 #英国留学生 #留学英国#英国大学 #英国大学申请 #英国研究生#英国研究生申请 #英硕 #英国硕士 #英国硕士申请 #英国硕士留学 #写出你想去的大学",07-25,images/66a2f76e000000000600e31b.jpg,avatars/66a2f76e000000000600e31b.jpg,1,0,0,0,N/A,/search_result/66a2f76e000000000600e31b?xsec_token=ABTf1sZPdZqrBy2x-QDlB9VPggcSiDePpqUb8WQYkFEfo=&xsec_source=
66a3293500000000050390d0,Joyce学姐,96,共 6 条评论,毕业可留美3年🔥美国1年制STEM硕士项目汇总,在美国，大多数提供硕士学位的商学院都开设一年制的商科硕士课程。 	 🌟本篇给大家盘点了美国名校的1年制STEM硕士，包括： 	 ✅麻省理工大学 ✅哥伦比亚大学 ✅纽约大学 ✅芝加哥大学 ✅约翰霍普金斯大学 ✅杜克大学 ✅密歇根大学安娜堡分校 ✅圣路易斯华盛顿大学 ✅埃默里大学 ✅圣母大学 ✅乔治城大学 ✅南加州大学 ✅UCLA ✅UCB 	 #留学美国 #美国留学申请 #美国大学申请 #美研 #美研申请 #美国研究生申请 #泛商科 #美国研究生 #美国硕士申请 #美国名校,07-26,images/66a3293500000000050390d0.jpg,avatars/66a3293500000000050390d0.jpg,1,0,0,0,N/A,/search_result/66a3293500000000050390d0?xsec_token=ABM4bVPwfesG1VvUAxcJckWQ1u9H-6gF8ZnDhLUeoOTWw=&xsec_source=
672b294a00000000190186ea,温柔的blink(美国版),4,0,🔥一年制美国商科硕士项目大揭秘🔍,1年制的STEM 硕士项目时间短，留学成本也较低，适合想快速去往职场的人深造！ 今天为大家整理了这些学校供大家参考 1⃣哥伦比亚大学 2⃣约翰霍普金斯大学 3⃣圣路易斯华盛顿大学 4⃣密歇根大学安娜堡分校 5⃣南加州大学 6⃣德州大学奥斯汀分校 7⃣东北大学 ❗STEM 项目就业率广，底薪更高，更容易拿绿卡❗ 👉👉需要了解美国一年制商科硕士的留A 👉👉需要了解美国硕士、本科留学的留B 也欢迎大家后台📬小编，小编乐于为大家解答美国留学问题！ #留学规划 #留学美国 #美硕 #美研 #美国商科 #美国留学生 #美国一年制商科硕士 #商科留学 #美国一年制硕士 #美本,11-06 四川,images/672b294a00000000190186ea.jpg,avatars/672b294a00000000190186ea.jpg,1,0,0,0,N/A,/search_result/672b294a00000000190186ea?xsec_token=ABMJIcWLvpUwc08iIAQ2lywPVMA9lVNh8UJnF8MH8t7RI=&xsec_source=
66ea88eb00000000120136e6,加录学长,48,0,加拿大1年制但属于STEM的范商科专业,随着移民政策的变化，目前蕞收益的就是硕博留学生项目，硕博项目中，又以STEM项目最佳。 	 ✅加硕士留学优势 * 一年制也可获得3年毕业工签 * 在安省无需工作也可以直接获得PR * 学签政策不受影响，不需要省证明信 * 可获得配偶工签 	 有想要学商科的同学注意，今天给大家罗列一些属于STEM专业的范商科项目： 🌟滑铁卢大学- 量化金融与风险管理硕士 -Masterof Quantitative Finance 🌟西蒙弗雷泽大学-大数据硕士(Master of Science in Big Data) 🌟女王大学-管理分析硕士(Masterof Management Analytics) 🌟约克大学-商业分析与数据科学硕士(Masterof Business Analytics) 🌟安大略省理工-财务数据分析- Financial Data Analytics (Master's program） 🌟安大略省理工-商业分析和人工智能-Business Analytics and AI (Master's program) 	 具体的申请要求，欢迎大家举手～ 	 #加拿大留学移民  #加拿大硕士  #加拿大申请  #加拿大签证  #加拿大会计  #加拿大会计硕士  #加拿大硕士留学,09-18,images/66ea88eb00000000120136e6.jpg,avatars/66ea88eb00000000120136e6.jpg,1,0,0,0,N/A,/search_result/66ea88eb00000000120136e6?xsec_token=ABymin6bOGvXJ0J-4BgR0bZtuSNYvtQsAADtxFMmVAIZ8=&xsec_source=
6724aa76000000001b028eea,芋泥学姐,26,共 1 条评论,2025QS商科硕士商业分析排名✨,2025QS商科硕士商业分析排名❗️❗️ 2025QS商科硕士商业分析排名❗️❗️ 2025QS商科硕士商业分析排名❗️❗️ - 📍商业分析硕士是一种专门研究商业数据的收集、处理、分析和应用的商科硕士专业。 ✅注重数据科学、机器学X、人工智 能和商业智 能等领域，通常需要有较强的编程、数据库和统计学能力，以及对商业问题的理解和解 决方案的设计，而其他商科硕士专业可能对这些方面的要求不那么严格。 🌟商业分析硕士的毕业生更容易在互联网、电 子 商务、金融服务、咨 询公司和政 府机构等行业找到工作。 - 🎯今天为大家带来了，2025年商科硕士商业分析排名一览！ 为大家区分了各个国家地区，以便查阅~ 目前2025QS学科排名榜只出了商科和全球MBA，大家注意甄别！ 后续有消息再为大家更新~ - 英国硕士申请1️⃣ HK硕士申请2️⃣ 澳洲硕士申请时间3️⃣ 新加坡硕士申请时间4️⃣ 爱尔兰硕士申请时间5️⃣ #留学  #留学申请季  #26fall留学  #商科  #qs排名  #硕士留学  #世界大学排名  #25fall留学  #qs世界大学排名  #商业分析,编辑于 11-01,images/6724aa76000000001b028eea.jpg,avatars/6724aa76000000001b028eea.jpg,1,0,0,0,N/A,/search_result/6724aa76000000001b028eea?xsec_token=ABwaxMZC_cj2XcvJYYBMOzDvTJGrrTED2zdju2ONtHRx0=&xsec_source=
66daee460000000025033ee5,小红薯662E74DD,61,共 4 条评论,英国金融硕士申请要求看这篇就够了‼,"🤔 英国商科为何如此受欢迎❓ - 🧐 作为全球金融中 心之一，英国与纽约齐名，位居世界榜shou。在全球高等教育研究机构 QS 发布的 2023 商科硕士排名中，英国凭借其独特魅力吸引着众多学子。 - 而金融学（Finance）💰一直稳居在英国商科五大热门专业的第.一名🥇 今天学姐就来为大家盘点一下！英国金融硕士具体的申请情况吧！ - ✅英国金融硕士留学院校+专业+申请条件 ✨帝国理工学院 专业：金融学理学硕士 申请条件：GPA85+；雅思7.0 . ✨剑桥大学 专业：金融学硕士 申请条件：GPA85+；雅思7.0 ✨伦敦大学学院 专业：金融学理学硕士 申请条件：GPA85+；雅思7.0 . ✨爱丁堡大学 专业：金融学理学硕士 申请条件：GPA80+；雅思6.5 . ✨曼彻斯特大学 专业：金融学理学硕士 申请条件：GPA80+；雅思6.5 . ✨伦敦大学国王学院 专业：金融分析理学硕士 申请条件：GPA82；雅思6.5 . ✨伦敦政.治经济学院 专业：金融学理学硕士 申请条件：GPA85+；雅思7.0 . ✨布里斯托大学 专业：金融与投.资理学硕士 申请条件：GPA82；雅思6.5 . ✨华威大学 专业：金融学理学硕士 申请条件：GPA80+；雅思6.5 . ✨格拉斯哥大学 专业：MF in International Finance 申请条件：雅思6.5，单项6.0/托福79(阅读13，听力12，口语18，写作21)/PTE59，单项59 . ✨利兹大学 专业：金融风险管理理学硕士 申请条件：GPA80+；雅思6.5 . ✨杜伦大学 专业：金融学理学硕士 申请条件：雅思6.5，单项6.0/托福92，单项23/PTE62，单项59 . ✨谢菲尔德大学 专业：金融理学硕士 申请条件：雅思6.5，单项6.0 . ✨诺丁汉大学 专业：金融与投.资理学硕士 申请条件：雅思6.5,单项6.0/PTE71,单项65/托福90(写作听力19,阅读20,口语22) . 😘大家可在图片中查看英国金融硕士的具体申请条件，有任何不懂得也可以直接dd学姐哟 💓问英国金融硕士选校定位，免费评估规划：A 💓问英国金融硕士详细申请条件：B 💓问靠谱英国留学机构：C #英国金融硕士 #英国一年制硕士 #英国商科硕士 #留学英国 #英国硕士 #金融硕士 #商科留学 #留学申请指南 #英国留学申请条件 #英国一年制硕士申请条件",09-06,images/66daee460000000025033ee5.jpg,avatars/66daee460000000025033ee5.jpg,1,0,0,0,N/A,/search_result/66daee460000000025033ee5?xsec_token=ABJsyFR1oOzx98uJLevkfa1ilXmxzxLEitX15J0W3KHrk=&xsec_source=
67501db50000000007033670,优越教育留学通,1,0,美国1年制STEM商科类硕士汇总,"美国1年制STEM商科类硕士汇总 根据美国劳工统计局的数据，STEM专业带动的工作岗位，其增长速度和薪酬水平均在美国就业市场处于领先地位（STEM硕士项目的毕业生，可延长他们的选择性实习培训（OPT）至36个月）。 	 1年制的STEM硕士项目时间短🥰，留学成.本也相对较低。 	 👇下面，为大家整理了2025美国名校1年制STEM商科/泛商科硕士项目及申请要求，感兴趣的同学可做参考。 	 哥伦比亚大学 约翰霍普金斯大学 圣路易斯华盛顿大学 密歇根大学安娜堡分校 南加州大学 德州大学奥斯汀分校 东北大学 	 💪🏻美国一年制STEM硕士，相比2年制硕士，时长、费用均砍半。可谓将成.本降到蕞低，就业力拉到蕞高，简直是性价比天.花板！太值得留子们冲了! - ✨而且就业面更广、起薪更高、拿绿卡更容易！STEM项目的中国留学生平均薪资可达到560,000至5100,000之间 	 具体申请要求、学费、学制看图文哦 . 💌🙋‍♀优越留学—2009 年成立于英国伦敦，英国本土留学机构，牛津本硕博大满贯，专注留学申请 15 年 👉关于英美港新澳出国留学问题可以随时💌 优越留学为你解答呀~ 🥳祝大家都能拿到梦校offer #优越留学#优越教育#美国留学申请 #25fall美国留学 #美国硕士留学 #留学美国 #美国一年制硕士申请条件 #美国一年制硕士留学 #美国一年制商科硕士 #美国一年制硕士 #一年制商科 #商科留学",今天 04:15 上海,images/67501db50000000007033670.jpg,avatars/67501db50000000007033670.jpg,1,0,0,0,N/A,/search_result/67501db50000000007033670?xsec_token=ABjwmuXAN-vJGtYrkA7z8H8Y1IsfqWGgCeHf1XO0JPi1g=&xsec_source=
67309a91000000003c019b70,YY说澳,7,0,商科专业的出路,读商科同学的2条出路 10个中国留学生里，至少7个是读商科的。甚至有的大学硕士的商科直接就成了中国班。堪称反向留学可一点都不夸张呀。 你以为你商科毕业了，就能进投行或者四大， 当个consultant，穿梭在城市的各大机场🛫✈️🛬，停留在各大星级酒店🏨🏢🏪，开着各种的online会议，手里一直拿着美式咖啡☕️☕️。到了 office，做一点ppt，讨论怎么花刚下来的预算，搞搞应酬🥃🥃，联络人脉。看着蒸蒸日上的销售数据，满满的成就感。😍😍😍 	 然鹅，现实就是你毕业后发现找个工作难如登天，大厂投递的简历杳无音讯，竞争的同届选手宛如大神，最后很有可能只能从个普通公司的职能岗开局，要不销售做起，留学时后，教授所传达的领导力，分析力，都还不如来个手把手教Excel，ppt来的实用🥹🥹🥹 	 那么正确的姿势是什么呢？ 	 🛑有效实习❗️效实习❗️实习❗️习❗️始终强调，这里指的有效是你之后想去从业的方向，比如你是会计，就从最初的公司财务方向找实习，有了实战再去大公司，再去投递事务所，要学会不放弃，并不是说头一次没中就可以躺平🚫因为等到你毕业出站的时候，你的对手可没有躺平的。 这里YY哥送各位两个大坑一定不要去避开🛑🚫🛑 1️⃣不要去做无效率工作，比如什么活动展览志愿者，行业频繁变化的初级岗位等，因为实习要带给你经验，要有行业方向 2️⃣不要去花钱🚫🛑🚫千万不要去花钱❗️买什么大厂的远程实习，还有什么类似于什么优秀青年或者创业者什么精英交流活动，最后拿一证书，没用的。因为实习的甲方看的不是你的tittle，要脚踏实地的提高🥹 🛑第二点是什么呢，只需要一项写进你简历的东西，并且是实战经验，操作起来便捷，学习过程短暂并且也免费，怎样做，评论区私我告诉你🤓 #澳洲移民 #商科留学 #商科求职 #澳洲硕士申请 #留学申请规划,11-10 马来西亚,images/67309a91000000003c019b70.jpg,avatars/67309a91000000003c019b70.jpg,1,0,0,0,N/A,/search_result/67309a91000000003c019b70?xsec_token=ABDV-dG19K2s1xK5ZRs_GfKCdDCiPzbcGK3Wp4zlUj7Ps=&xsec_source=
6708d34f000000002c02b67d,Doris学姐,23,共 1 条评论,哥大33个商科项目分析,今天给大家带来了哥伦比亚大学商科项目的申请条件盘点！哥大位于纽约市中心，是全球最优秀的商业学府之一，其商科项目更是声名远扬！ 首先，想要申请哥伦比亚大学商科项目的同学需要具备一些基本条件。第一，拥有本科学位并表现出优异的学术成绩。平均GPA需要在3以上，最好能达到3.5+，对托福和雅思成绩也有一定要求。耶！学霸们，你们听懂了吗？ 	 其次，申请者需要提交GMAT或者GRE成绩。这就意味着你需要展示出强大的逻辑思维能力和数学技能。但别怕，只要你好好准备，拿到好成绩并不难！ 第三，商科项目非常重视申请者的实践经验。所以，如果你有在商业领域的相关实习或者工作经验，一定要在申请材料中突出这一点。如果你现在还没有经验？没关系，赶紧去找一份实习或者参加一些相关的培训课程吧！ #哥伦比亚大学 #商科 #商科留学 #商科硕士 #留学美国 #留学申请指南 #美国研究生 #研究生申请 #留学中介 #留学申请季 #当代读书人,10-11,images/6708d34f000000002c02b67d.jpg,avatars/6708d34f000000002c02b67d.jpg,1,0,0,0,N/A,/search_result/6708d34f000000002c02b67d?xsec_token=ABhlAfxcZoZz4kJoYI8N3rbLKl6n1tY3y2IQvMcrTflyc=&xsec_source=
