URL,Author Name,Likes,Comments,Post Title,Caption,Date Published,Images,Author Avatar,Stars,Author Collect Nr,Author Fans Nr,Author Note Nr,Video URL,User URL
6717731b000000001602157c,IsIa学姐留学日记,94,共 2 条评论,英国回国最被认可的商科院校‼️,今天我们盘点几个英国回国最被认可的商科院校 ✅️曼彻斯特大学：校友力量强大 ✅️华威大学：生源强，LSE和IC被录会选他 ✅️UCL：没有正统商学院，但生源强，质量不差 ✅️IC：学校优势专业很多 ✅️LSE：课程全面，英国本土就业更具攻击性 ✅️LBS：欧洲蕞好的商学院 ✅️牛津和剑桥：院校名声在外，商学院更不差 	 以上这几个学校，不仅留在英国本土会有很大的优势，回国更被认可，曼大跟其他几个院校相比可能会比较弱势，但是院校的能力还是杠杠的，KCL和爱宝虽然没有被提及，但是因为综合排名的缘故回国后也是被认可的，只不过会靠后这8所 	 #留学 #留学英国 #英国商科 #英国商科留学 #英国商科硕士 #英国商科留学申请要求 #英国硕士留学申请条件 #英国硕士申请要求 #英国留学院校定位 #王爱曼华申请,10-22,images/6717731b000000001602157c.jpg,avatars/6717731b000000001602157c.jpg,1,0,0,0,N/A,/search_result/6717731b000000001602157c?xsec_token=ABWKivQQ6mJ3As-JrceukC6105F9KBTwMH_ky_nx8PHtA=&xsec_source=
66d65547000000001f03e8f4,Kiki_,27,共 2 条评论,美国商科硕士申请条件新鲜出炉！,🎈美国商科硕士申请条件大揭秘！ 🎈美国商科硕士申请条件大揭秘！ 🎈美国商科硕士申请条件大揭秘！ . 🎐很多宝子都不清楚美国商科硕士申请条件。美国商科硕士申请条件有哪些？怎样达到美国商科硕士申请条件？今天就来给大家讲讲美国商科硕士申请条件啦。 . 👇美国商科硕士申请条件如下： . 🌟美国商科硕士申请条件【学术背景】 本科学位要求：申请者需要具备本科或本科以上学位。部分学校也可以接收具备大专学位的申请人，但一般要求有较好的工作经验。 . 🌟美国商科硕士申请条件【标准化考试】 语言考试：托福和雅思是美国院校普遍接受的语言考试。一般来说，托福成绩达到 100 分以上，雅思成绩达到 7.0 分以上申请优势更大。对于部分顶.尖院校，语言成绩要求可能更高。 . 🌟美国商科硕士申请条件【GMAT 或 GRE 成绩（部分专业要求）】 如果想申请商科硕士，GMAT 或 GRE 考试几乎是必不可少的。 . 🌟美国商科硕士申请条件【实习或项目经验】 美国的商学院非常注重学生的实践经验，尤其是对于 MBA 等专业，通常要求有 3 年以上的工作经验。 . 总之，申请美国商科硕士需要在学术、语言、实践等多个方面做好充分的准备。提前了解目标院校的具体要求，有针对性地提升自己的竞争力，才能顺利拿到心仪的 offer🎉💖！ . 今天关于美国商科硕士申请条件的普及就到这里啦！ . 求更多美国商科硕士申请条件 求美国传媒硕士申请条件 求美国工科硕士申请条件 求美国留学规划 求美国藤校申请条件 求美国留学机构 #美国商科 #美国商科留学  #美国商科硕士 #美国商科申请 #美国商科类硕士  ##美国商科研究生申请  #美国商科院校 #美国商科硕士申请 #美国商科排名 #美国留学,09-02,images/66d65547000000001f03e8f4.jpg,avatars/66d65547000000001f03e8f4.jpg,1,0,0,0,N/A,/search_result/66d65547000000001f03e8f4?xsec_token=ABpMYjeTqcbYXPeeyZGR7J99AAC5ga7fb1o8_K4PPLeJY=&xsec_source=
66f4012b000000002c02bb32,LLING,47,0,还有多少人不知道G5商科这么好申请？,"英国商科很多专业还是卡的不是很严的！在这里打破信息差 以下是G5硕捡漏专业👇 🌟帝国理工学院 	 1. 气候变化、管理与金融 MSc Climate Change, Management &amp; Finance 2. 国际健康管理 MSc Global Health Management 3. 金属与能源金融 Metals and Energy Finance 	 🌟伦敦政治经济学院 1. 全球管理学 Global Master’s in Management 2. 计量经济学和数理经济学 MSc Econometrics and Mathematical Economics 3. 经济史学 MSc in Economic History 	 🌟伦敦大学学院 1. 全球自然资源管理学 Global Management of Natural Resource 2. 比较商业经济学 Comparative Business Economics 3. 金融科技学 Financial Technology MSc 4. 城市经济发展学 MSc Urban Economic Development 	 需要规划可以私戳我哟 #留学申请指南 #留学offer #留学 #好好生活皆如所愿 #分享片刻 #记录吧就现在 #今日份今日发 #英国g5商科申请  #英国g5 #英国g5申请",09-25,images/66f4012b000000002c02bb32.jpg,avatars/66f4012b000000002c02bb32.jpg,1,0,0,0,N/A,/search_result/66f4012b000000002c02bb32?xsec_token=ABJZ2CVJxr648B_rIOeUJv013-YOOzeiuJps9FkcWmOqw=&xsec_source=
66f3c48e000000001a0201fe,Riiickkk,29,0,25fall 低GPA商科选校定位（水硕也是硕版,需要选校定位请看P4 	 #美研  #留学  #留学美国  #美国研究生申请  #研究生申请  #商科留学  #jhu  #水硕,编辑于 09-25,images/66f3c48e000000001a0201fe.jpg,avatars/66f3c48e000000001a0201fe.jpg,29,0,0,0,N/A,/search_result/66f3c48e000000001a0201fe?xsec_token=ABpbK6U3yUshBzhEIB7JkimOSCbu5H0C1u26H64hjMR5U=&xsec_source=
671e090a000000001b03c29b,芋泥学姐,34,共 1 条评论,🔥QS2025全球MBA（工商管理）排名,✅MBA一直是商科领域的一个热门选择，MBA的全称为Master of Business Administration，中文翻译为工商管理学硕士。 📍MBA是培养能够胜任企业和经济管理部门高层管理工作需要的务实型、复合型和应用型高层次管理人才，兼具理论与实践相结合。 - ⚠️关于MBA，这里提醒大家的一点是MBA的主要是面向有工作经验的人士，一般要求是有三年以上工作经验。 🚫也就是说应届生或者刚毕业1-2年的学生通常是不能申请的。 ✔️如果你是应届生或者刚毕业1-2年，并且想读管理学硕士的话，那么MIM（Master in Management ）就是一个非常适合你的专业。 - 再说回MBA，MBA非常适合在职人士继续深造以提升自身的学历水平。那么MBA该如何选择呢？MBA的排名可以作为一个选校方面的参考。 - 🎯在2025QS全球全日制MBA排名中： 🔹斯坦福大学商学院MBA连续第五年获得榜一，其出色表现是由于全球蕞佳的校友成果和卓越的毕业生就业能力表现。 🔹第二名是宾夕法尼亚大学沃顿商学院，哈佛商学院位居全球第三。 - 🎯2025年全球MBA欧洲排名中： 🔹伦敦商学院位列欧洲弟一，全球第五，拥有英国排名蕞高的MBA项目。 🔹剑桥大学贾奇商学院位列欧洲第三，全球第七。 🔹巴黎高等商学院位列欧洲第二，英国之外的其他欧洲国家中排名弟一，全球第六。 🔹IE商学院、IESE 商学院、欧洲工商管理学院、帝国学院商学院、牛津大学赛德商学院等也位列欧洲和英国地区的前列。 - 🎯在2025QS全球全日制MBA亚洲地区排名中： 🔹新加坡国立大学（NUS）获得亚洲弟二，位列全球第25名。其在就业能力指标中位列亚洲弟一，并且在校友成果和思想领导力方面也处于亚洲领先地位。 🔹清华大学的MBA项目紧随其后，成为亚洲第三，且位列全球第29名，其优 秀的排名源于其出色的意见领导力和就业能力指标；排名亚洲第四的是新加坡南洋理工大学。 - 🎯2025年全球MBA澳洲排名中： 🔹墨尔本商学院被评为大洋洲地区全日制MBA项目的蕞佳商学院，位列全球第32名。 🔹和悉尼大学商学院被评为大洋洲第三，位列全球第45名。 #留学  #留学申请季  #26fall留学  #25fall留学  #留学生必备  #qs排名  #qs世界大学排名  #MBA  #世界大学排名  #qs2025  #商科留学,编辑于 10-27,images/671e090a000000001b03c29b.jpg,avatars/671e090a000000001b03c29b.jpg,1,0,0,0,N/A,/search_result/671e090a000000001b03c29b?xsec_token=ABdCn6cA9zGzhVx2Y_kzys_MH_f5pyo_oqfiQAgY1N8-4=&xsec_source=
672187b5000000001a037052,小醒留学记录册,42,共 6 条评论,重磅！2025 QS 商科排名正式发布！,💥商科留学必看！QS商科排名新鲜出炉啦~ 💁下面，小醒就带大家深入了解各国家各院校商学院的表现，有读商科意向的同学可以参考一下哟~ 	 ✅2025 QS 商学院排名Top10 📍斯坦福大学商学院 📍沃顿商学院 📍哈佛商学院 📍伦敦商学院 📍巴黎高等商学院MBA 📍马萨诸塞州理工学院斯隆管理学院 📍伦比亚商学院 📍IE商学院 📍剑桥大学嘉治商学院 📍IESE商学院 	 1⃣了解美国商科申请条件 2⃣了解英国商科申请条件 3⃣了解中国香港商科申请条件 4⃣了解澳洲商科申请条件 5⃣了解加拿大商科申请条件 6⃣了解新加坡商科申请条件 7⃣了解其他国家商科申请条件 #qs商科排名 #2025qs商科硕士排名 #QS商科硕士排名 #商科类留学院校QS排名 #世界大学排名,10-29,images/672187b5000000001a037052.jpg,avatars/672187b5000000001a037052.jpg,1,0,0,0,N/A,/search_result/672187b5000000001a037052?xsec_token=ABuNDmsIwHRXExqpQU8OGQ4AUio3arfTgPo22FsC2Jses=&xsec_source=
65b02f3e000000002b03ec3b,伊桑嘿,341,共 142 条评论,🇩🇪留学 | 德本商科低绩点 出路讨论,德国商科相对好毕业，但卷绩点。偶尔会刷到成绩相对没那么优秀的商科同学在焦急地询问出路，感觉也算是我们这个群体的困境之一。我本人成绩也比较寒碜，不至于毕不了业，但确实没什么竞争力。所以想结合自己的经验分享一些参考方向 转战其它国家也是不错的想法，但我没什么经验 --- 德语区不卡绩点的公立学校硕士项目 如果想留在德国上公立大学，可以考虑以下学校的商科项目： LMU（BWL德+英授，GMAT600+可免申请筛选考试。雅7.5或6.5+本科英授课学分。线上面试） 柏林自由（德授FACT专业，参考毕业论文） 亚琛工大（BWL德授非NC，点击就送） 哥廷根大学（德授/英授多专业，线下面试） 如果考虑奥地利，以下两所也挺不错： 维也纳经济大学（德授专业均为非NC，王牌专业Management也点击就送。有入学考试筛人但据说不难） 维也纳大学（BWL德授非NC，点击就送） 各硕士项目申请时间差异大，尽量提前查阅官网，做好时间规划。并且申请条件每年可能会变动，以最新官网信息为准，对自己负责 申请德国私立商校硕士项目（英授，线上面试） 私立商校不把硬绩点和高G作为必要录取标准，而是考察申请者的整体情况 实习经历和英语沟通水平应该属于比较重要的录取影响因素 用18个月的找工作签证自愿实习&amp;刷GMAT，申请下一年入学Zu 虽然已经有很多人建议拖着一门课不考，利用学生身份攒实习经验，但也有像我这样因为安排出现意外只能直接毕业的怨种…如果学签无法无缝衔接，用找工作签实习虽然小众，但也可行 尽量找国际化公司，对Gap Year实习/自愿实习/外国学生的包容度较高 在没什么讨价还价资本的情况下，建议按实习六个月去规划。我当时面试的所有实习岗都问我能不能做满六个月，即使职位描述只写三个月 直接就业 如果没有明确职业方向，可以在LinkedIn搜一搜中国学生都去了什么企业，这些企业对外国人的接受度相对高 也可以考虑华人物流公司（大多在北威州），能办理工签。不管怎样这算是一条可以用来保底的途径吧，这类公司近几年需求量还挺大的 --- 对于商科同学，不论成绩是否优秀，都建议早作职业规划，多积累德国本地的实习/学生工经验，持续提高自己的德语英语能力，以免陷入太被动的局面 总而言之，不论是靠学签、找工作签还是工签，留下的方法有很多，不用因此而过于焦虑 	 #德国 #德国留学党 #德国工作 #德国签证,01-23,images/65b02f3e000000002b03ec3b.jpg,avatars/65b02f3e000000002b03ec3b.jpg,1,0,0,0,N/A,/search_result/65b02f3e000000002b03ec3b?xsec_token=ABE2mwhVA90hid-SmqUwLbjuS9sHOh7aLQXA8x-YSU0GY=&xsec_source=
672c28ac000000003c01ea59,剑桥小米,17,共 5 条评论,申请英国商科硕士|实习要如何规划,"嗨👋大家好我是在剑桥读MFE的Mia～ . ‼️就算都是商科专业，具体的规划路径也完全不同。 ✅今天我就和大家全面解析一下，申请商科不同的细分专业，实习和应该如何匹配。 . 1️⃣Finance 类专业 . ➡️实习：如果是想申请金融专业，首先要明确自己以后是想做一级市场还是二级市场。 🔹如果以后你想在文书中写以后要做IB/PE/VC，那么实习最好也是类似的，最多加一点行研。 🔹如果是想做二级市场，比如trading, quant, 那不妨从小的量化岗位做起，加深自己的programming 能力。 . 🌟🌟金融行业的实习一定要注意2个点： . 1️⃣实习内容永远大于公司title。 因为金融行业历来都很卷，像BB行和国内的头部券商，如果不是顶级名校根本拿不到实习面试的机会，一般大家都是从小公司干起，只要是做一些比较实际的工作就可以 . 2️⃣银行、以及券商的营业部、私人银行部、保险公司的前端，都是申请金融专业的避雷专业，说白了这类的工作内容都是维护客户关系和销售，且都是家长托关系找的，也不会做什么实事，⚠️和金融就没什么关系，放简历里不如不放。 . 2️⃣management专业 📝Managment专业涉及的知识面其实最广，所以实习的可选择范围也会大一些。管理ZX、战略ZX、快消、行研、甚至一些start up，这些能积累一些行业研究、数据分析能力、市场推广、战略部署之类能力的实习都可以。 . 👉🏻如果是以后有创业想法，要申请创业项目的同学，也可以一段自己在想做的行业内的实习，一段管理相关的上述行业。到时候我们根据文书的career goal 具体去把他们串起来就行 . 3️⃣Marketing 📚marketing其实是很容易转专业的，只要和品牌推广，数据分析，包括互联网营销相关的实习都没问题。比如快消公司、互联网大厂、ZX、所有名企的市场部、以及现在的MCN公司都可以！ . 🛎如果大家对于英国商科硕士还有其他问题，👉🏻欢迎来找我讨论哦～ #留学英国 #剑桥MFE #剑桥大学#牛津大学 #牛剑申请 #英国g5申请 #商科留学 #英国硕士申请 #商科实习 #得知课堂",11-06 浙江,images/672c28ac000000003c01ea59.jpg,avatars/672c28ac000000003c01ea59.jpg,1,0,0,0,N/A,/search_result/672c28ac000000003c01ea59?xsec_token=ABi-WlgaBBaBwn8AzIymBcA0k92SCL3y8ZKm9bwprIWdI=&xsec_source=
66cc89f0000000001d039a3a,Cathy学姐,42,共 1 条评论,美国🇺🇸商科STEM专业推荐,🌈美国商科STEM专业具有多方面的优势，这些优势主要体现在就业前景、薪资水平、研究与创新机会、跨学科能力培养以及政策支持等方面 1️⃣就业前景： 商科STEM专业结合了商业知识和STEM技能，使毕业生在高科技行业、金融服务业、制造业、医疗保健等多个领域都有广泛的就业机会 2️⃣OPT时间延长 对于国际学生来说，商科STEM专业的毕业生可以申请额外24个月的OPT（Optional Practical Training）延期，总计可达36个月。这为他们提供了更多时间在美国合法实习和工作，从而更容易找到理想的工作并申请H1B工作签证😊 3️⃣薪资潜力 根据美国劳工统计局和相关行业报告，STEM毕业生的终生收入通常比非STEM毕业生高出约87%💰 4️⃣政治支持 美国政府高度重视STEM教育的发展，通过制定一系列政策、投入大量资金来鼓励和支持STEM领域的研究与教育。这为商科STEM专业的学生提供了良好的外部环境♻️和资源支持 #商科留学 #商科 #留学 #美国商科硕士 #美国商科留学 #美国商科研究生申请 #留学选校,08-26,images/66cc89f0000000001d039a3a.jpg,avatars/66cc89f0000000001d039a3a.jpg,1,0,0,0,N/A,/search_result/66cc89f0000000001d039a3a?xsec_token=ABSMBpGSD-oGyJAHSyIQ3PPZ7WJG9IXswnyQrJUS3PWqs=&xsec_source=
6744f642000000000703779e,我可以准时毕业！,27,共 55 条评论,德国英授商科硕士可以按时毕业吗？,德国🇩🇪英授商科硕士可以按时毕业吗？ 	 之前在国内做行政四五年，本科内容忘光的情况下。第一学期来德国读书觉得压力挺大的，英语自认好过平均水平（听阅都是8以上），还是上课只能听懂20%的东西，本质是上课的知识点不懂，不像有的同学可能英语一般，但题目看看就懂了。 	 想问问有没有和我一样，本科知识不记得，数学也不擅长的德国留学生，商科（管理类方向）好好学，能按时四学期毕业吗？ 	 如果有上学经验也可以分享给我～ 谢谢#德国 #德国留学党 #商科留学 #英授硕士,11-25 德国,images/6744f642000000000703779e.jpg,avatars/6744f642000000000703779e.jpg,1,0,0,0,N/A,/search_result/6744f642000000000703779e?xsec_token=ABvhpGFfS5dcpOFdXytuXkl8uEFnceD10s2LDs_b7dT2g=&xsec_source=
663de35e000000001e0382b1,Jenn学姐商科留学,66,0,毕业后可留美三年‼️美国商科STEM硕士项目,👉今天Jenn学姐给大家整理了美国商科STEM硕士项目，考虑留美的同学赶紧收藏！ . 🌟STEM专业优势： 🔸OPT延期政策：STEM专业的国际学生可以申请比普通专业更长的Optional Practical Training（OPT）时间，从标准的12个月延长至36个月，这为他们提供了更多的时间来获得工作经验和提高职业技能。 🔸就业前景和薪资：STEM专业毕业生通常在美国拥有更好的就业前景和更高的薪资水平。 . 🌟STEM商科专业盘点 信息系统管理、商业分析、供应链管理、金融工程 、量化金融、数据科学、市场营销 、经济学 . 🌟热门STEM项目 🔸信息系统管理 纽约大学 MS in Information Systems 西北大学 Accelerated MS in Information Systems（MSIS） 麻省理工学院 Master of Science in Management Studies (MSMS) 🔸商业分析 MIT Master of Business Analytics MBAn 哥伦比亚大学 MS in Business Analytics (MSBA) 🔸供应链管理 麻省理工学院 Master of Engineering in Supply Chain Management 密歇根大学安娜堡分校 Master of Supply Chain Management (MSCM) 🔸金融工程/量化 卡内基梅隆大学Master of Science in Computational Finance (MSCF) 🔸数据科学 哈佛大学 Master's in Data Science 🔸市场营销 西北大学 Integrated Marketing Communication 🔸经济学 JHU-国际经济与金融硕士Master of International Economics and Finance（MIEF) . 👉Jenn姐~10年专注美研文商科高端留学规划 👉美国MBA、MPP/MPA、BA、DS、金融方向、市场营销、经济学、会计等专业相关问题，留学申请可戳我~ #大学#美国大学#美国大学申请#商科#商科留学#STEM #商科硕士 #stem #留学美国#留学申请季#留学那些事,05-10,images/663de35e000000001e0382b1.jpg,avatars/663de35e000000001e0382b1.jpg,1,0,0,0,N/A,/search_result/663de35e000000001e0382b1?xsec_token=ABWu8Xxow0zKH-7ZZaNPFbJ-B272XNYPE9RS20oSOk7LM=&xsec_source=
66cf13d8000000001d015fcb,kiki学姐,9,0,UC系有哪些高性价比的美研泛商科项目✅,🌟泛商科在传统商科竞争越来越大的情况下，很多想进名校但是背景不够强的学生被拒之门外，因此泛商科是个很好的选择，这些泛商科专业并未开设在商学院下，而是开设在工程学院、人文社科等学院下。 	 - ✅今天学姐给大家盘点了美研UC系这3⃣所院校【UCLA🔹UCB🔹UCSD】的泛商科项目，想去加州读研究生的宝子们，除了项目介绍外，还包括大家关心的学制、学费情况，快来看看吧～ 1⃣加州大学伯克利分校 ✅Master of Financial Engineering金融工程硕士 ✅Master of Development Engineering发展工程硕士 ✅Master of Analytics分析学硕士 ✅Master of Public Policy公共政策硕士 2⃣加州大学洛杉矶分校 ✅Master of Quantitative Economics数量经济硕士 ✅Master of Public Policy公共政策硕士 ✅Master of Financial Engineering金融工程硕士 3⃣加州大学圣地亚哥分校 ✅MS in Finance金融硕士 ✅MS in Business Analytics商业分析硕士 一些项目细节可以看⬆️图！ #加州伯克利大学 #加州伯克利 #泛商科 #泛商科留学 #泛商科硕士 #美国留学申请 #美国硕士留学 #美国硕士留学申请,08-28,images/66cf13d8000000001d015fcb.jpg,avatars/66cf13d8000000001d015fcb.jpg,1,0,0,0,N/A,/search_result/66cf13d8000000001d015fcb?xsec_token=ABA0MeyAselQPrFdALoKgrYtaBoF-U5JOU6XC-jEhvlF8=&xsec_source=
6724d332000000003c01d2fe,十六的留学日记,28,共 5 条评论,美国热门金融工程/金融数学项目申请梯队,美国留学中商科学生占比蕞高🤏，而金融工程/金融数学专业（Financial Engineering）来又是商科蕞热门研究生项目之一。💁今天学姐就来为大家介绍这个神秘而多金专业～ 	 ✨️金融工程专业一直以来都以高就业率、高薪水、高回报而受到众多申请者的青睐。金融工程/金融数学硕士统称为 MFE 金融工程，它们的实质都是一样的。🤏在美国， MFE 项目通常属于 STEM，有 36 个月的 OPT 实习期，对于毕业后想留美的同学而言这也是一大吸引点。 💥另外，这个专业也为理工背景的人提供了转行的机会，对于理科成绩好，并且对金融感兴趣的同学，这是一个非常不错的选择✔。 	 💁学姐今天就给大家分享这期美国金融工程专业留学院校申请梯队 ⭕️Tier 0 普林斯顿大学 卡内基梅隆大学 巴鲁克学院 	 ⭕️Tier 1 第.一梯队 哥伦比亚大学 麻省理工学院 加州大学伯克利分校 纽约大学 	 ⭕️Tier 2 第二梯队 加州大学洛杉矶分校 芝加哥大学 康奈尔大学 加州大学伯克利分校 杜克大学 佐治亚理工学院 	 ⭕️Tier 3 第三梯队 南加州大学 北卡罗来纳州立大学 华盛顿大学 约翰霍普金斯大学 南加州大学 	 ✊️MFE课程时间较短，仅需1~2年的时间，绝大部分MFE的同学毕业后都有机会进入投行、券商、基金公司、风险管理部门等高薪行业，💫从事定量和技术性工作。 而在录取方面，学校主要考察申请者的先修课程、工作/实习经验以及GPA、GRE等硬件成绩。 	 🌈需要美国金融工程留学申请规划+择校：A 🌈需要靠谱的美国金融专业留学机构：B 	 #美国留学申请 #25fall美国留学 #美国硕士留学 #美国金融工程 #美国金融硕士 #美国金融工程硕士 #美国金融数学 #金融数学 #金融工程硕士 #留学申请季,11-01,images/6724d332000000003c01d2fe.jpg,avatars/6724d332000000003c01d2fe.jpg,1,0,0,0,N/A,/search_result/6724d332000000003c01d2fe?xsec_token=ABwaxMZC_cj2XcvJYYBMOzDkYorcp1gnuyF5SyVJKWhIc=&xsec_source=
