URL,Author Name,Likes,Comments,Post Title,Caption,Date Published,Images,Author Avatar,Stars,Author Collect Nr,Author Fans Nr,Author Note Nr,Video URL,User URL
66824578000000000d00f76a,北美学长,52,共 1 条评论,美国最受欢迎10大研究生专业！,TOP1️⃣金融学 FINANCE/FINANCIAL MANAGEMENT 商科一直是美国申请的大热门。 金融硕士的研究方向涉猎广泛，涵盖投资、金融工具定价及深度研究、金融市场分析、财务深入研究、银行业务，以及数学统计等诸多领域。 就业方向上，金融硕士倾向于金融机构、投资银行等领域，很多毕业生会进入银行、投行、券商、咨询等公司。 热门院校：普林斯顿、哥大、耶鲁、圣路易斯华盛顿大学、范德堡大学等 TOP2️⃣计算机科学 Computer Science 随着各行各业的计算机应用越来越广泛，市场对于CS专业人才的需求也日益增长。 Masters programs guide统计，拥有硕士学位的计算机和信息科学家年薪超过11.8万美元，并且未来10年内，CS就业前景会增长10-20%。 就业方向有非常多的选择，比如，对于每个企业而言，软件开发与维护都非常重要，需要大量的软件工程师和网络安全工程师。 此外，眼下人工智能大热，AI相应的岗位需求也非常旺盛。 🏫热门院校： 麻省理工MIT、卡内基梅隆大学、伊利诺伊香槟、佐治亚理工、斯坦福、马里兰帕克等 TOP3️⃣ 数学 MATHEMATICS 可能有同学认为数学专业的应用性有限，事实上，拥有数学硕士学位的同学们广泛涉足于多个领域，比如投资分析师、会计师、精算师、运筹学分析师等。 市场上的薪资水平也很可观，比如精算师的平均年收入可达到10.2w美元，足以证明数学专业人才在职业市场上的价值与潜力。 正所谓“学好数理化，走遍天下都不怕”！ 热门院校：普林斯顿大学、麻省理工MIT、斯坦福大学、加州大学伯克利、约翰霍普金斯、卡内基梅隆大学等 完整榜单： 1、金融学 FINANCE/ FINANCIAL MANAGEMENT 2、计算机科学 COMPUTER SCIENCE 3、数学 MATHEMATICS 4、市场营销 MARKETING 5、石油工程 PETROLEUM ENGINEERING 6、工商管理 BUSINESS ADMINISTRATION 7、教育学 EDUCATION 8、统计学 STATISTICS 9、创业学 ENTREPRENEURSHIP 10、管理信息系统 MANAGEMENT INFORMATION SYSTEMS 以上有没有你所感兴趣的专业呢？ #世界名校 #留学 #美国 #留学规划 #美国留学申请 #,07-01,images/66824578000000000d00f76a.jpg,avatars/66824578000000000d00f76a.jpg,1,0,0,0,N/A,/search_result/66824578000000000d00f76a?xsec_token=ABxBibjswUUVPKlPO9ZyKUzmSTaza2I8r8ywy47zxyDy8=&xsec_source=
6703c98f000000002c02b157,Larry学长,12,0,🇺🇸美研商科热门🔥细分方向解析✔️,👉美国的商科细分专业众多，学长给大家整理了美研商科专业最热门🔥的6大方向： ✅金融专业 ✅金融工程专业 ✅会计专业 ✅商业分析专业 ✅市场营销专业 ✅工商管理专业 - 篇幅有限，详情见图片⬆️ 有任何关于美研商科项目申请的有关问题，欢迎随时滴我～ #美国研究生 #美研商科 #留学科研项目 #留学科研背景提升 #商科留学 #留学 #美国硕士 #美国硕士申请,10-07,images/6703c98f000000002c02b157.jpg,avatars/6703c98f000000002c02b157.jpg,1,0,0,0,N/A,/search_result/6703c98f000000002c02b157?xsec_token=ABIPJF7hxaxWASVq0niwXdNlwyobQwpLc0J68kgL8RzIg=&xsec_source=
674d8324000000000601650f,IsIa学姐留学日记,4,0,耶鲁大学M2M，体验2个国家的学习‼️,美国商科硕士的同学，很多同学都想去哈佛、耶鲁、普林斯顿、斯坦福或麻省理工。但顶尖商学院主要集中在MBA项目，纯商科类硕士项目在藤校几乎不存在 	 关于管理类硕士，哈佛商学院没有应届生项目，普林的金融项目是偏金工的，康奈尔有一个国际管理（MiM）课程，但需要与康奈尔应用经济与管理硕士项目（AEM）合修，不是独立学位项目。但是今天整理的这个项目-耶鲁M2M是一个凤毛麟角的存在 	 耶鲁M2M项目是一个为期两年的double degree管理学硕士项目。 简单来说，耶鲁M2M项目有三条路线： ✅️巴黎高商HEC+Yale Track ✅️香港科技大学HKUST+Yale Track ✅️加拿大英属哥伦比亚UBC+Yale Track 学生第一学年在HEC、HKUST或UBC学习管理学，第二年在耶鲁大学管理学院（SOM）攻读全球商业与社会（GBS）项目。 该项目旨在培养年轻领导者，提高他们运用管理技能解决商业和社会问题的能力。 #留学 #留学美国 #美国留学选校定位 #耶鲁大学 #耶鲁M2M #美国管理学 #美国商科留学 #美国常青藤 #美国研究生留学申请 #美国研究生硕士申请,2 天前 北京,images/674d8324000000000601650f.jpg,avatars/674d8324000000000601650f.jpg,1,0,0,0,N/A,/search_result/674d8324000000000601650f?xsec_token=ABykIYSBoljPDChLSgpkxOLdROxd0jp7KzMWvBBmCpoqU=&xsec_source=
671069b300000000160229ae,西澤,10,共 2 条评论,羞耻感爆棚 商科硕士还要做小学生级别pre,别看幻灯片 看看人就好 越饿越瘦了 	 #大学生上课图鉴 #康奈尔大学 #留子的精神状态 #美区留子 #依托答辩 #留学 #大学老师 #高中老师,10-16,images/671069b300000000160229ae.jpg,avatars/671069b300000000160229ae.jpg,1,0,0,0,N/A,/search_result/671069b300000000160229ae?xsec_token=ABUQxpnR6d0acERzYmXM5JIwsR88Yxte5yRjPeGdW34I8=&xsec_source=
669a694200000000250075df,Sara学姐,34,共 1 条评论,哥大无G可冲的商科类项目✅附详细介绍‼️,📍25Fall的申请不久之后就要开始了，对于一些来不及或者没有考出理想GRE成绩的同学，可以重点关注一些GRE optional的项目，做好专业规划✅ 	 🙋🏻‍♀️Sara给大家汇总了美国大热院校哥伦比亚大学的一些商科项目，无G也可以申请哦！ 1⃣️MSc in Business Analytics商业分析硕士 2⃣️MSc in Management Science and Engineering管理科学与工程理学硕士 3⃣️MSc in Financial Engineering金融工程硕士 4⃣️MSc in Operations Research运筹学硕士 5⃣️Masters in Industrial Engineering工业工程硕士 6⃣️MA in Statistics统计学硕士 7⃣️MSc in Applied Analytics应用分析硕士 8⃣️MS in Enterprise Risk Management企业风险管理硕士 9⃣️MS in Technology Management技术管理硕士 	 🌟持续更新🇺🇸留学干货 👉🏻有任何问题都可以随时📩 #留学美国 #美国留学申请 #哥伦比亚大学 #哥大研究生 #哥大 #美国研究生申请 #美研申请 #美国硕士申请 #美国硕士留学 #美国商科硕士,07-19,images/669a694200000000250075df.jpg,avatars/669a694200000000250075df.jpg,1,0,0,0,N/A,/search_result/669a694200000000250075df?xsec_token=ABcIpOCA4-WlmlVxhceASCZj2XRmpQdJWiV-Etj5J7VLw=&xsec_source=
6448e1370000000027010190,冰美式留学频道,219,共 5 条评论,美国商科一年制硕士项目，申美不看亏亿！！,🍃今天想跟大家聊聊的是美国一年制硕士项目，其中不乏top50的美国强校。今天整理的商科项目有： ✨金融专业 ✨会计专业 ✨BA商业分析 ✨市场营销 . 🇺🇸美国的金融项目大都是一年制，美国商学院主要是以MBA为主，所以开设MSF的学校比较少，TOP50的院校中只有不到20所院校有纯金融项目。 . 🇺🇸其实美国的会计专业绝大多数都是一年制项目，一般两年制的学生主要针对本科非会计专业的学生，🌻会计项目对申请者的数学能力要求比较高，美国top50会要求GPA3.5以上，托福100以上 . 🇺🇸Business Analytics项目在TOP50院校中有大概25所设立了相关项目，😭同样对申请者的数学要求很高 . 🇺🇸市场营销专业是同学们问的比较多的，比较偏好有工作经验的申请者，⚠️建议大家多提升自己的软实力背景。 . 🍃其他美国商科一年制硕士的项目都已经整理在图中啦，大家还想了解哪些美国硕士申请项目或者申请流程欢迎问询。 🌈大家有留学选校、申请规划、留学中介方面的问题都可以滴滴冰美式 #留学申请季 #留学美国 #一年制硕士 #美国留学申请 #美国一年制硕士 #美国商科硕士 #美国一年制商科硕士 #美国留学中介 #美国留学机构 #美国商科留学,2023-04-26,images/6448e1370000000027010190.jpg,avatars/6448e1370000000027010190.jpg,1,0,0,0,N/A,/search_result/6448e1370000000027010190?xsec_token=ABAyyJfIIfI5NoN2GKcrtT2GVp3XOPfSKYMIyTnHYZaE0=&xsec_source=
66fa2ed9000000001b02103e,暴走e人,13,0,美国一年制商科硕士项目汇总,根据美国劳工统.计局的数据，STEM专业带动的工作岗位，其增长速度和薪酬水平均在美国就业市场处于领先地位。STEM专业学生的OPT可延长至36个月。 所以将STEM与泛商科项目结合起来，是一个潜力无限的黄金选择。 — 	 ⭕学姐为大家整理了美国名校一年制STEM泛商科硕士项目及申请要求，感兴趣的同学可做参考噢 1️⃣麻省理工学院-金融硕士 2️⃣哥伦比亚大学-市场营销硕士 3️⃣约翰·霍普金斯大学-金融硕士 4️⃣伊利诺伊大学香槟分校-会计硕士 5️⃣圣母大学-商业分析硕士 6️⃣密歇根大学安娜堡分校-管理学硕士 7️⃣乔治城大学-管理学硕士 8️⃣纽约大学-会计硕士 9️⃣加州大学洛杉矶分校-商业分析硕士 1️⃣0️⃣德克萨斯大学奥斯汀分校-商业分析硕士 👉具体申请要求看图文噢~ 	 需要了解美国商科硕士申请1 需要商科择校建议和留学规划2 	 #美国商科硕士  #美国商科硕士文书  #美国商科留学  #美国留学申请  #美国大学  #美国一年制商科硕士  #美国一年制STEM商科硕士  #美国一年制商科留学  #美国商科留学  #美国商科留学机构  #美国商科留学申请,09-30,images/66fa2ed9000000001b02103e.jpg,avatars/66fa2ed9000000001b02103e.jpg,1,0,0,0,N/A,/search_result/66fa2ed9000000001b02103e?xsec_token=ABThy8gFZj-iqZhyox49z5KgafB7IwZS_SUxTsItlEEP4=&xsec_source=
66eac588000000000c01a1dd,Allen不想搞钱,3,0,美国商科硕士一年需要花多少钱？,"在美国读商科硕士一年的花费主要包括学费和生活费两大部分，整体费用在40万-70万人民币左右。具体情况如下： 	 1. 学费： • 私立大学：一般来说，美国私立大学商科硕士的学费较高，每年大约在5万-8万美元，折合人民币35万-58万左右。例如，纽约大学斯特恩商学院的商科硕士项目学费在$59,020-$71,025之间；哥伦比亚大学商学院的商科硕士项目学费为$64,024-$69,556。 • 公立大学：公立大学的学费相对便宜一些，每年大概在1.3万-2万美元，约合人民币9万-14万。不过，一些比较知名的公立大学的学费也可能会较高，例如，密歇根大学的某些商科硕士项目学费也可能达到每年4万-5万美元左右。 	 2. 生活费： • 住宿费：美国不同地区的住宿费用差异较大。学校宿舍每月大约800-900美元；寄宿家庭每月600-2000美元；校外租房每月300-3000美元以上。如果选择在纽约、洛杉矶等大城市的市中心或繁华地段租房，费用会更高。 • 饮食费：每年大约2500美元，这只是一个平均水平，如果经常在外面就餐或者对饮食有较高要求，费用会增加。 • 其他费用：包括水电费、暖气费、网络费、交通费等，每月大约200-300美元，一年下来大概2400-3600美元。此外，还需要留出至少2000美元作为其他杂费。 	 美国留学问题可 	 #留学申请指南 #留学申请季 #美国硕士申请 #美国研究生 #美国研究生申请",09-18,images/66eac588000000000c01a1dd.jpg,avatars/66eac588000000000c01a1dd.jpg,1,0,0,0,N/A,/search_result/66eac588000000000c01a1dd?xsec_token=ABymin6bOGvXJ0J-4BgR0bZh72WZgN971W-5RukmSKDCY=&xsec_source=
666ec3f4000000000d00f030,立梦,31,共 1 条评论,🇺🇸美国MSF/MFin金融硕士项目录取标准,"Princeton, MIT, Columbia, Yale等顶级MFin金融硕士相关项目，统计了官网录取学生的平均分数，可以对标✅ 这次选取的是不太quant方向，美国的项目整体对quant的要求比较高，比如Princeton MFin其实就是很quant的项目，MIT MFin很多同学都走的quant方向 	 另外，比较好的项目基本都要求GRE/GMAT，硬性规定，就算没有硬性要求也建议尽量考高提交～但不用太纠结，过bar就行，申请还是要看综合profile哒 	 #写出你想去的大学 #商科留学 #金融硕士 #留学美国 #研究生申请 #麻省理工学院 #耶鲁大学 #普林斯顿大学 #🇺🇸你的梦校是",06-16,images/666ec3f4000000000d00f030.jpg,avatars/666ec3f4000000000d00f030.jpg,1,0,0,0,N/A,/search_result/666ec3f4000000000d00f030?xsec_token=ABxxMsI6U4J450IB8rKzDbMSoL6eSmDL2hxgCnAXHq5_k=&xsec_source=
659e58bd000000000f01e049,暴走留学姐,319,共 25 条评论,💸商科专业看看这些国家 99%首选！,商科专业依然是留学生的一个热门选择，就业率高、薪资水平也很高！在众多国家和院校的选择中，确实让人眼花缭乱。为了帮助大家决策，下面列举一些热门的商科留学国家以及一些备受欢迎的商学院： 	 🇺🇸美国 麻省理工大学斯隆商学院 克伦比亚大学 杜克大学 西北大学 纽约大学斯特恩商学院 约翰霍普金斯大学 斯坦福大学 哈佛大学 宾夕法尼亚大学沃顿商学院等 	 🇬🇧英国 伦敦商学院 帝国理工学院商学院 爱丁堡大学商学院 曼彻斯特大学商学院 杜伦大学商学院 利兹大学商学院 伯明翰大学商学院等 	 🇨🇦加拿大 多伦多大学 麦吉尔大学 滑铁卢大学 不列颠哥伦比亚大学 蒙特利尔大学 麦克马斯特大学等 	 🇦🇺澳大利亚 墨尔本大学 新南威尔士大学 悉尼大学等 	 🇸🇬新加坡 新加坡国立大学商学院 南洋理工大学南洋商学院等 	 🇳🇱荷兰 鹿特丹商学院 阿姆斯特丹大学商学院等 	 🇫🇷法国 巴黎高等商学院 法国高等经济商业学院 欧洲商学院 里昂商学院 	 这些国家和院校都因其商科专业的优质教育和国际声誉而备受推崇。 当选择留学国家和院校时，建议考虑个人的职业规划、语言能力以及生活成本等因素，以做出更符合个人需求的决策。 文本有限‼️具体可滴～ #当代读书人 #商科 #商学院 #留學 #硕士 #商科留学 #留学英国 #留学美国 #留学申请季,01-10,images/659e58bd000000000f01e049.jpg,avatars/659e58bd000000000f01e049.jpg,1,0,0,0,N/A,/search_result/659e58bd000000000f01e049?xsec_token=ABR6tXzBoZMwujl6s2iG0Ftod6pkyU5J02tf8e_yznjXM=&xsec_source=
6710e04d000000001b0107e0,IsIa学姐留学日记,20,0,纽约大学泛商科硕士项目申请要求‼️,泛商科专业以广泛的适应性和跨学科的特性，成为了的申请的热门专业，而且吸引着很多非商科专业的同学，泛商科不仅涵盖了传统商科的精髓，还融合了新兴技术、社会科学等多个维度的知识，为申请者提供了丰富的选择空间。 纽约大学斯特恩商学院作为仅次于沃顿商学院排名第二的商学院，它的泛商科项目也是种类繁多，而且还有很多申请要求相对宽松的“宝藏”项目。对于那些希望从非商科领域跨越到商科领域的同学而言，纽约大学的泛商科项目无疑是一个很好的选择。 	 今天学姐整理了纽约大学泛商科的硕士项目申请要求，详细👀上图哦~ 	 #留学 #留学美国 #美国商科留学 #美国商科硕士 #纽约大学 #纽约大学斯特恩商学院 #泛商科 #泛商科硕士申请 #纽约大学硕士申请 #泛商科留学,编辑于 10-17,images/6710e04d000000001b0107e0.jpg,avatars/6710e04d000000001b0107e0.jpg,1,0,0,0,N/A,/search_result/6710e04d000000001b0107e0?xsec_token=ABUQxpnR6d0acERzYmXM5JI78VXSGf_lKzENI0lGKgoLQ=&xsec_source=
64dcede9000000001700f05d,Blink商科留学申请,102,共 14 条评论,管理学硕士回国认可度,仅供参考 篇幅所限，学校没有列全 欢迎讨论,2023-08-16,images/64dcede9000000001700f05d.jpg,avatars/64dcede9000000001700f05d.jpg,1,0,0,0,N/A,/search_result/64dcede9000000001700f05d?xsec_token=ABkqjNV9Itf2yVjoaDP4rGnIwvjlyloRvbLtThjH8381Y=&xsec_source=
6638f978000000001e02f73f,新航道前程留学,1965,0,商科留学热门专业🤨有你Pick的吗⁉️,"Business 商科专业涵盖了广泛的领域，旨在培养具备不同商业职能和管理能力的专业人才。今天为大家详细整理了商科6大常申请方向，还不快来看看 ，哪个适合你啊？ 	 ⬇️⬇️⬇️ 详情🔎见图2⃣️-图7⃣️ 💟一.商科Business方向项目参考： 🔎1.Finance 🔎2.Economic 🔎3.Business Analytics 🔎4. Marketing 🔎5. Accounting 🔎6. Management 	 💟二. 商科6大方向（背景/课程要求/实习项目） 🔎①背景：要求申请人背景为商科/经济学等相关专业背景 🔎②课程：经济学（宏观经济学和微观经济学），统计学和概率论，企业金融（财务管理），投资学金融市场与机构 🔎③实习：Big name投行，Investment Bank,Sales&amp;Trading,Equity Research,Risk Management/Summer Intern 顶级咨询公司的Summer Intern /PTA,外资银行 	 💟三.商科具体的项目推荐/申请难度： 📍Finance ,Economics 申请难度较高，顶级项目录取为；3.7+/4 GRE :325+ ,GMAT:720+.相关实习活动3-4段。 📍BA，冲刺名校项目，top 30： GPA:3.6+/4 GRE：325+ 实习3段 📍MKT 泛商科项目，可以冲刺TOP 10/ IVY 项目，GPA:3.6-3.7+/4 GRE:325+ 实习3段 📍Accounting,注重实习经历，不支持跨专业申请，建议GPA:3.7+/4 GRE；320+ 会计相关实习3段 📍Management 管理学，MIS,SCM,（有CS课程要求）MPA,MPP均属于管理项目（HYPSM项目） ————————— 🚗Business Major直通车🚗 💥提供1🆚1评估院校，记得带背景！ #商科 #商科留学 #business #商业分析 #金融学 #经济学 #市场营销 #会计学 #管理学 #商科硕士 #商科实习  #投行实习 #美国硕士   #金融工程 #四大行#海外留学",编辑于 05-06,images/6638f978000000001e02f73f.jpg,avatars/6638f978000000001e02f73f.jpg,1,0,0,0,N/A,/search_result/6638f978000000001e02f73f?xsec_token=ABX6zqsX8f5QWO8nNhlvIbRiuXdSejcgVAcCRWA3hdpd0=&xsec_source=
65719964000000003403fede,重庆留学Tina,34,共 1 条评论,英国商科硕士排名出炉✅读它就业稳了‼️,🔎今年QS商科硕士排名参考如下五大指标： ·就业能力：35%（金融/BA占比30%） ·校友成果：15%（金融/BA占比20%） ·投资回报率：20% ·思想领导力：20% ·班级和教师多样性：10% 	 🔎五大指标当中，就业能力占比达到30~35%。足以见得这次排名非常重视毕业生的就业能力，这对以就业为导向的同学们有很高的参考价值。 	 💡管理学： 管理学申请对学生的专业背景要求不高，接受学生跨专业申请。不过因为门槛不高，申请量较大，一般竞争比较激烈。 均分要求方面，一般 80/85 分即可申请，但是想要拿 Offer 一般需要 85 以上，如果申请排名靠前的几所大学比如 LBS 、 IC 、 LSE 等，则是建议刷到 88 分以上。 	 💡市场营销： 市场营销和管理学类似，申请门槛不高，也可以跨专业申请，但是就是因为对专业背景要求不高可以跨申，申请量也很大，竞争比较激烈。 均分方面，一般保持在 80 以上就有希望申请到英国 top100 大学，如果想要申请到英国前 50 大学则是建议保持在 85 最好 88 分以上。 	 💡供应链管理： 供应链专业也是接受跨申的，门槛不高，另外供应链专业在商学院中相对冷门一些，竞争没有那么激烈，比较好申请。 均分方面，一般保持在 80 分以上即可，如果想要申请曼大等学校，建议保持在 85/87 分以上。 	 💡商业分析： 商业分析的申请难度一般都不低，需要商科、理工类背景且有一定定量基础，最好还需要带上 GMAT/GRE 申请。均分方面建议保持在 85 分左右，如果是申请前四所大学，则是建议保持在 90 分左右。 	 💡金融学： 金融学一直都是各大商学院的王牌专业，一般需要商科背景才可以申请，且会核查学生核心课程成绩。另外申请时最好带上强有力的实习和 GMAT/GRE 成绩。均分方面，申请以上院校一般都需要 85 分以上，想要拿 Offer 则是需要 90 分甚至更高的成绩。 	 #当代读书人 #笔记灵感 #英国留学 #商科 #留学申请季 #商科留学 #重庆留学 #梦马帮留学,2023-12-07,images/65719964000000003403fede.jpg,avatars/65719964000000003403fede.jpg,1,0,0,0,N/A,/search_result/65719964000000003403fede?xsec_token=ABJae_ntW251XsiHjlPT1OFqr-9zFEKAoeLIk8oBBHneU=&xsec_source=
662f82d5000000001e03ae01,Cindy日记,105,共 1 条评论,美研商业分析项目4大申请难度梯队分析📝,🇺🇸如果要盘点近几年留美最热门的商科专业，那么商业分析一定是其中之一！ 🔥这几年BA项目一直很火，归根结底有以下三个原因： • 三年OPT增加留美几率 • 商科项目中比较好跨的专业 • 就业机会多，起薪高 🏫数据分析领域的兴起，让同学们也动起了转专业的念头。于是这几年美国各大高校纷纷开办商业分析项目。十年前美国还只有零星几个学校开设BA项目，而现在美国前100的学校中已经约有一半的学校开设。 📈热度高自然也意味着申请人数多、录取门槛变高，再加上商业分析还对有相关理工科背景的同学情有独钟，所以想拿到offer还是有难度的！ — 我是Cindy🎒 留学圈的大反派：分享美国留学相关内容 #美国商业分析硕士申请 #美国商业分析专业 #美国商业分析硕士 #美国研究生申请 #美国研究生选校 #美国硕士选校 #美国硕士申请 #美国硕士留学 #美国大学申请,编辑于 05-05,images/662f82d5000000001e03ae01.jpg,avatars/662f82d5000000001e03ae01.jpg,1,0,0,0,N/A,/search_result/662f82d5000000001e03ae01?xsec_token=AB-59y_QLOogCSEEYFYhKBcemjIzuiqq5vQxF3mk3AKJU=&xsec_source=
674ffcd800000000070272f2,莎莎同学(去留学版),1,0,新西兰一年制跨背景商科硕士 掌管留学的神,"第一次知道新西兰是一个学姐推荐给我的，刚好当时要去那边玩，她就带我参观了她的学校🏫那会我才知道她原来是在新西兰读硕，比起英国留子来讲，新西兰留子的精神状态简直不要太美丽，学费低，性价比高，天气好，每天过得都很滋润，留学体验高了不止一倍，回来我就问她要了新西兰一年制商科硕士的汇总 	 奥克兰理工大学 👇 ✔️专业会计硕士 ✔️市场营销硕士 ✔️应用金融硕士 ✔️工商管理硕士 ✔️供应链管理硕士 -开学时间：3、10月 	 林肯大学👇 ✔️商务硕士（金融学 ） ✔️商业硕士（全球管理和市场营销） -开学时间：11月（1年完成），2/7月（1.5年完成） 	 维多利亚大学👇 ✔️会计硕士专业学位 -开学时间：2/11月；学制1年 -入学要求：均分75-80%；需要PS CV ✔️全球商业硕士 -开学时间：11月 -入学要求：均分75-80% 	 怀卡托大学👇 ✔️工商管理硕士 -开学时间：2、7、11月 -入学要求：不限制本科专业，最后一年均分70+ 	 ✔️专业会计硕士 -开学时间：1 、11月； -入学要求：不限制本科专业，最后一年均分70+ 	 ✔️管理硕士（农业综合企业、商业分析、项目管理或供应链管理） - 入学要求：跨专业背景申请，本科最后一年均分70%以上 	 ✔️应用金融硕士 -开学时间：2月开学 -入学要求：任何专业本科学士学位，最后一年平均成绩不低于B(75%)，至少在大二学过定量分析的课程 -雅思 6.5 (6.0) 	 ✔️商业创新技术硕士 -开学时间：开学2 ,7月； -入学要求：不限制本科专业，大四成绩75%+ 	 🔔趁着新西兰留学还没那么热门🔥，学校要求也没很高申请还不是特别难，感兴趣的宝子快来✉️学姐！#新西兰 #硕士 #留学 #商科 #金融 #奥克兰",今天 01:55 广东,images/674ffcd800000000070272f2.jpg,avatars/674ffcd800000000070272f2.jpg,1,0,0,0,N/A,/search_result/674ffcd800000000070272f2?xsec_token=ABkiqMl2Wkrzew1wXNuuODiyy9Y1rlRuQbVhi9HFqS3Ig=&xsec_source=
